id,title,location,sub_category,avatar,description,details,provider,distance,ages,price,campus,camp_type,topics,category,relevance,affordability
0,KidzToPros,Multiple Locations,Hip Hop Online Course Free Activities,https://images.activityhero.com/provider_photo/145594/tile/c45b1cae-48bc-496a-bf7c-c00a6aaea2aa.jpg,"From coding in scratch and python to LEGO Masters, graphic design, art skills, sports and more, KidzToPros takes fun and enrichment to the next level! Our…read more >",https://www.activityhero.com/biz/kidztopros,https://images.activityhero.com/59989/crop/bfc8ad6c-a2f5-48fd-b5e0-bdbbea11be47.png,7,"5, 17",140,m,STEM,"[['fun', 48.56], ['environment', 12.5], ['engage', 11.54], ['hand', 7.21], ['great', 5.29], ['local', 4.81], ['year', 3.85], ['personal', 2.4], ['perfect', 1.92], ['fill', 1.92]]",Computer Science,59.33,69.99
1,Petits Pas,Multiple Locations,Crafts Dance Yoga,https://images.activityhero.com/provider_photo/105608/tile/483c5dbb-f1b9-4220-be70-51c9d72af2f1.jpg,"By combining a variety of classes (Yoga, Ballet, Barre au sol & Modern jazz), Petits Pas celebrates our senses and teaches us to express ourselves through…read more >",https://www.activityhero.com/biz/petits-pas,https://images.activityhero.com/58965/crop/3998e0d4-85e2-4018-bd86-86747e6ff3b4.png,12.9,"5, 17",0,f,STEM,"[['base', 30.29], ['program', 21.14], ['project', 13.71], ['yoga', 9.14], ['lead', 5.71], ['innovative', 4.57], ['nature', 4.57], ['develop', 4.0], ['teach', 4.0], ['workshop', 2.86]]",Computer Science,88.07,94.98
2,Crissy Field Center Summer Camp,"Crissy Field Center - San Francisco, CA",Nature Programs Backpacking Adventure/Outdoors,https://images.activityhero.com/provider_photo/141838/tile/338673f0-3944-4deb-afb0-6d493bfb4426.JPG,"About Crissy Field CenterThe Crissy Field Center’s mission is to encourage new generations to become bold leaders for thriving parks, healthy communities,…read more >",https://www.activityhero.com/biz/2575-crissy-field-center-summer-camp-san-francisco-ca,https://images.activityhero.com/2179/crop/de986391-d511-4d13-8488-0906c029cf89.gif,23.9,",18",100,"m,f",Arts,"[['mission', 39.26], ['theatre', 9.82], ['promote', 9.2], ['performance', 7.36], ['gymnastic', 7.36], ['healthy', 6.75], ['offer', 6.13], ['training', 4.91], ['lead', 4.91], ['chef', 4.29]]",Arts and Design,86.96,43.99
3,Early Childhood Matters,Multiple Locations,Family Mindfulness Preschool,https://images.activityhero.com/provider_photo/93766/tile/0c6e86b1-993e-4110-89d9-6fb36f0a8b15.jpg,Supporting Families on the Road to Connected and Effective ParentingEarly Childhood Matters focuses on the early years (0-5) where the most crucial brain…read more >,https://www.activityhero.com/biz/early-childhood-matters,https://images.activityhero.com/57089/crop/9894cba6-28ae-4a9e-a04d-ed14005c0d05.jpg,24.6,"5,18",45,"m,f",STEM,"[['year', 36.17], ['teaching', 13.48], ['inspire', 9.93], ['teen', 8.51], ['theater', 7.09], ['kind', 6.38], ['positive', 4.96], ['method', 4.96], ['mindfulness', 4.26], ['broadway', 4.26]]",Math & Logic,32,44.13
4,Art School of SF Bay,Multiple Locations,Cartooning Visual Arts Drawing and Painting,https://images.activityhero.com/provider_photo/112974/tile/38a9ea2d-5ec0-4ba3-b6fc-25d445402224.JPG,"We teach classical art - in a modern way. Our classes are fun and effective, our methods creative and our students’ results are spectacular!We teach our…read more >",https://www.activityhero.com/biz/art-school-of-sf-bay,https://images.activityhero.com/10531/crop/1505266_502789629835885_1383645892_n.jpg,25,"5, 17",110,"m,f",STEM,"[['teach', 37.89], ['professional', 13.68], ['teacher', 10.53], ['instruction', 10.0], ['run', 6.84], ['coach', 5.26], ['parent', 4.21], ['background', 4.21], ['basic', 3.68], ['video', 3.68]]",Math & Logic,92.51,79.88
5,Quantum Martial Arts,Multiple Locations,Tumbling Martial Arts Sports,https://images.activityhero.com/provider_photo/101551/tile/d4a69829-8ffc-49bf-b3b0-40eb0771d065.jpg,Quantum Martial Arts is a nonprofit community dojo in the heart of San Francisco's Mission District. We teach non-competitive Tae Kwon Do to our kids…read more >,https://www.activityhero.com/biz/quantum-martial-arts,https://images.activityhero.com/59627/crop/a3b9a02c-3b11-4aa6-988b-c93a194db5d7.png,27.2,",18",320,"m,f",Arts,"[['mission', 39.26], ['theatre', 9.82], ['promote', 9.2], ['performance', 7.36], ['gymnastic', 7.36], ['healthy', 6.75], ['offer', 6.13], ['training', 4.91], ['lead', 4.91], ['chef', 4.29]]",Arts and Design,58.05,81.62
6,Geary Dance Center,Multiple Locations,Dance Jazz Performing Arts,https://images.activityhero.com/provider_photo/96357/tile/498bc0e3-a4f5-424a-a023-73e4c9afb6a4.jpg,"Welcome to Geary Dance Center, the San Francisco Richmond District's newest center for dance excellence! We offer a wide variety of dance classes for…read more >",https://www.activityhero.com/biz/geary-dance-center,"data:image/png;base64,iVBORw0KGgoAAAANSUhEUgAAAAEAAAABCAYAAAAfFcSJAAAAAXNSR0IArs4c6QAAAARnQU1BAACxjwv8YQUAAAAJcEhZcwAADsQAAA7EAZUrDhsAAAANSURBVBhXYzh8+PB/AAffA0nNPuCLAAAAAElFTkSuQmCC",31.1,"12,19",540,"m,f",Arts,"[['dance', 36.9], ['training', 12.83], ['ballet', 9.63], ['open', 8.56], ['space', 8.02], ['meet', 5.88], ['natural', 5.35], ['toddler', 4.81], ['joy', 4.81], ['west', 3.21]]",Arts and Design,41.24,99.59
7,It's Yoga Kids,Multiple Locations,Online Course Fitness Yoga,https://images.activityhero.com/provider_photo/95949/tile/bffefba9-dd87-4417-9e55-6d9308f214e4.jpg,Yoga matters NOW more than ever! Be YOUR Best with evidence-based mindset and movement practices that build healthy sustainable habits for happy…read more >,https://www.activityhero.com/biz/1058-it-s-yoga-kids-san-francisco-ca,"data:image/png;base64,iVBORw0KGgoAAAANSUhEUgAAAAEAAAABCAYAAAAfFcSJAAAAAXNSR0IArs4c6QAAAARnQU1BAACxjwv8YQUAAAAJcEhZcwAADsQAAA7EAZUrDhsAAAANSURBVBhXYzh8+PB/AAffA0nNPuCLAAAAAElFTkSuQmCC",47.4,"5,18",2999,"m,f",STEM,"[['good', 21.43], ['world', 15.08], ['future', 12.7], ['individual', 10.32], ['active', 9.52], ['knowledge', 7.14], ['feature', 6.35], ['change', 6.35], ['improve', 5.56], ['benefit', 5.56]]",Computer Science,92.11,50.34
8,San Francisco Botanical Garden,"SF Botanical Garden - San Francisco, CA",Preschool Nature Programs Play/Outdoor,https://images.activityhero.com/provider_photo/139816/tile/8341c7e3-d96b-4802-9618-3ba2a93a9eab.jpg,Garden Camp registration is tentatively closed as we work to re-configure our summer sessions to meet San Francisco Health Order and Summer Camp Directive…read more >,https://www.activityhero.com/biz/san-francisco-botanical-garden-society,"data:image/png;base64,iVBORw0KGgoAAAANSUhEUgAAAAEAAAABCAYAAAAfFcSJAAAAAXNSR0IArs4c6QAAAARnQU1BAACxjwv8YQUAAAAJcEhZcwAADsQAAA7EAZUrDhsAAAANSURBVBhXYzh8+PB/AAffA0nNPuCLAAAAAElFTkSuQmCC",62.3,"5,25",190,"m,f",STEM,"[['age', 46.46], ['offer', 18.69], ['level', 15.66], ['beginner', 4.55], ['inspire', 4.04], ['foundation', 2.53], ['garden', 2.02], ['daily', 2.02], ['elite', 2.02], ['gain', 2.02]]",Computer Science,96.71,50.84
9,DogCamp for Kids,"Golden Gate Park - San Francisco, CA",Animals Adventure/Outdoors Mindfulness,https://images.activityhero.com/provider_photo/6219/tile/beach_tire_083.JPG,"DogCamp for Kids, 9am-3pm, brings children and dogs together in a natural setting. Drop Off/ Pick Up in Golden Gate Park, near Polo Fields. Based on our…read more >",https://www.activityhero.com/biz/19576-dogcamp-for-kids-san-francisco-ca,"data:image/png;base64,iVBORw0KGgoAAAANSUhEUgAAAAEAAAABCAYAAAAfFcSJAAAAAXNSR0IArs4c6QAAAARnQU1BAACxjwv8YQUAAAAJcEhZcwAADsQAAA7EAZUrDhsAAAANSURBVBhXYzh8+PB/AAffA0nNPuCLAAAAAElFTkSuQmCC",66.3,"5,17",25,m,Sports,"[['activity', 20.12], ['include', 15.98], ['fitness', 15.98], ['performing_arts', 9.47], ['week', 8.88], ['field', 8.88], ['park', 8.88], ['exciting', 4.73], ['cultural', 4.14], ['theme', 2.96]]",Personal Development,47.05,73.42
10,San Francisco Sabre Fencing,"Main Location - San Francisco, CA",Fencing Sports After School Care,https://images.activityhero.com/provider_photo/110206/tile/5819660f-7ba7-4a55-9984-258bafb6290d.jpg,Fencing is a sport that has maintained its popularity over centuries. It is one of the original sports of the modern Olympic Games and is gaining in…read more >,https://www.activityhero.com/biz/san-francisco-sabre-fencing,"data:image/png;base64,iVBORw0KGgoAAAANSUhEUgAAAAEAAAABCAYAAAAfFcSJAAAAAXNSR0IArs4c6QAAAARnQU1BAACxjwv8YQUAAAAJcEhZcwAADsQAAA7EAZUrDhsAAAANSURBVBhXYzh8+PB/AAffA0nNPuCLAAAAAElFTkSuQmCC",62.3,"5,17",12,m,Sports,"[['sport', 28.24], ['offer', 24.12], ['variety', 11.76], ['facility', 8.24], ['place', 5.88], ['fence', 4.71], ['staff', 4.71], ['craft', 4.12], ['entertainment', 4.12], ['wide', 4.12]]",Personal Development,86.48,36.72
11,Aventuras,Multiple Locations,Flexible Booking Science & Technology Spanish Visual Arts,https://images.activityhero.com/provider_photo/135213/tile/f57d7d17-ef93-4721-97dd-7d9a42a8b245.jpg,"Our Spanish Immersion programs are creative, interactive, and fun! At Aventuras, we know that kids are natural learners. We strive to inspire them and…read more >",https://www.activityhero.com/biz/aventuras,"data:image/png;base64,iVBORw0KGgoAAAANSUhEUgAAAAEAAAABCAYAAAAfFcSJAAAAAXNSR0IArs4c6QAAAARnQU1BAACxjwv8YQUAAAAJcEhZcwAADsQAAA7EAZUrDhsAAAANSURBVBhXYzh8+PB/AAffA0nNPuCLAAAAAElFTkSuQmCC",74,"5,17",16,f,Arts,"[['language', 17.11], ['school', 13.16], ['development', 12.5], ['preschool', 12.5], ['teach', 8.55], ['immersion', 8.55], ['spanish', 8.55], ['english', 6.58], ['skill', 6.58], ['valley', 5.92]]",Arts and Design,75.32,46.46
12,Moving Arts Academy of Dance,Multiple Locations,Flexible Booking Dance Ballet Online Course,https://images.activityhero.com/provider_photo/123573/tile/1cad8e5b-4252-4a04-ad3c-7fd4baa70064.jpeg,Moving Arts Academy of Dance provides a nurturing environment for students to excel technically and artistically. We are located in the Mission Terrace…read more >,https://www.activityhero.com/biz/moving-arts-studio,"data:image/png;base64,iVBORw0KGgoAAAANSUhEUgAAAAEAAAABCAYAAAAfFcSJAAAAAXNSR0IArs4c6QAAAARnQU1BAACxjwv8YQUAAAAJcEhZcwAADsQAAA7EAZUrDhsAAAANSURBVBhXYzh8+PB/AAffA0nNPuCLAAAAAElFTkSuQmCC",92.1,"5,17",8,f,Arts,"[['dance', 36.9], ['training', 12.83], ['ballet', 9.63], ['open', 8.56], ['space', 8.02], ['meet', 5.88], ['natural', 5.35], ['toddler', 4.81], ['joy', 4.81], ['west', 3.21]]",Arts and Design,79.07,41.7
13,"Wheel Kids Bicycle Club, Inc.",Multiple Locations,Best of ActivityHero 2019 Best of ActivityHero 2015 Best of ActivityHero 2016 Fitness Adventure/Outdoors Play/Outdoor,https://images.activityhero.com/provider_photo/4484/tile/WKBC-08.jpg,"Wheel Kids is an adventure and exploration bike camp that uses bicycling as a means of transportation, personal development and fun.With locations in San…read more >",https://www.activityhero.com/biz/wheel-kids-bicycle-club-inc,"data:image/png;base64,iVBORw0KGgoAAAANSUhEUgAAAAEAAAABCAYAAAAfFcSJAAAAAXNSR0IArs4c6QAAAARnQU1BAACxjwv8YQUAAAAJcEhZcwAADsQAAA7EAZUrDhsAAAANSURBVBhXYzh8+PB/AAffA0nNPuCLAAAAAElFTkSuQmCC",8,"5, 18",120,m,Arts,"[['offer', 27.5], ['locate', 20.62], ['small', 10.62], ['write', 9.38], ['writing', 6.25], ['begin', 5.62], ['specialize', 5.62], ['fashion', 5.0], ['kindergarten', 5.0], ['read', 4.38]]",Arts and Design,49.36,43.11
14,Dance Mission Youth Program,Multiple Locations,Best of ActivityHero 2015 Best of ActivityHero 2016 Contemporary Hip Hop Dance,https://images.activityhero.com/provider_photo/6674/tile/Dance_Brigade_2013_-_0147.jpg,"Dance Brigade’s Youth Program provides high-quality dance classes to the youth of San Francisco in a noncompetitive, socially aware environment. We…read more >",https://www.activityhero.com/biz/2591-dance-mission-youth-program-san-francisco-ca,"data:image/png;base64,iVBORw0KGgoAAAANSUhEUgAAAAEAAAABCAYAAAAfFcSJAAAAAXNSR0IArs4c6QAAAARnQU1BAACxjwv8YQUAAAAJcEhZcwAADsQAAA7EAZUrDhsAAAANSURBVBhXYzh8+PB/AAffA0nNPuCLAAAAAElFTkSuQmCC",13.9,"5, 18",1999,m,Arts,"[['dance', 36.9], ['training', 12.83], ['ballet', 9.63], ['open', 8.56], ['space', 8.02], ['meet', 5.88], ['natural', 5.35], ['toddler', 4.81], ['joy', 4.81], ['west', 3.21]]",Arts and Design,48.62,92.76
15,Tech Rocks!,Multiple Locations,Best of ActivityHero 2015 Best of ActivityHero 2016 Science & Technology Programming Computers,https://images.activityhero.com/provider_photo/32949/tile/33dc5bff-c8a2-4eef-a62d-62ac7579413c.JPG,"At Tech Rocks!, we make tech fun!
We engage our students with technology and show them how they can be a part of what's to come.  In our experience,…read more >",https://www.activityhero.com/biz/tech-rocks,"data:image/png;base64,iVBORw0KGgoAAAANSUhEUgAAAAEAAAABCAYAAAAfFcSJAAAAAXNSR0IArs4c6QAAAARnQU1BAACxjwv8YQUAAAAJcEhZcwAADsQAAA7EAZUrDhsAAAANSURBVBhXYzh8+PB/AAffA0nNPuCLAAAAAElFTkSuQmCC",24.9,",19",25,m,STEM,"[['kid', 47.29], ['tech', 9.36], ['technology', 8.87], ['teen', 8.37], ['parent', 8.37], ['robotic', 6.4], ['call', 3.45], ['business', 2.96], ['matter', 2.46], ['unique', 2.46]]",Computer Science,38.95,88.89
16,Always Learning and Growing,Multiple Locations,Nature Programs Hiking Adventure/Outdoors,https://images.activityhero.com/provider_photo/135063/tile/d6eff59c-8ec1-4c0a-9d2e-0a956f10f9ad.jpeg,Always Learning and Growing provides outdoor camps and classes for children and families with the goal of giving children the developmental benefits of a…read more >,https://www.activityhero.com/biz/always-learning-and-growing,"data:image/png;base64,iVBORw0KGgoAAAANSUhEUgAAAAEAAAABCAYAAAAfFcSJAAAAAXNSR0IArs4c6QAAAARnQU1BAACxjwv8YQUAAAAJcEhZcwAADsQAAA7EAZUrDhsAAAANSURBVBhXYzh8+PB/AAffA0nNPuCLAAAAAElFTkSuQmCC",25.6,"5,19",12,m,Sports,"[['adult', 27.78], ['family', 26.11], ['martial_art', 15.0], ['large', 6.67], ['self_defense', 5.56], ['part', 5.56], ['passion', 3.33], ['baby', 3.33], ['core', 3.33], ['mountain', 3.33]]",Personal Development,54.62,11.54
17,Maker Studio SF,Multiple Locations,Coding Building Programming,https://images.activityhero.com/provider_photo/100859/tile/25e52bcd-f2d2-42af-a9a0-3fae69a7e839.jpg,Founded in 2017 by a group of designers and engineers with a single mission to get more kids into STEM through creativity first. We started with our Fashion…read more >,https://www.activityhero.com/biz/maker-studio-sf-58963,"data:image/png;base64,iVBORw0KGgoAAAANSUhEUgAAAAEAAAABCAYAAAAfFcSJAAAAAXNSR0IArs4c6QAAAARnQU1BAACxjwv8YQUAAAAJcEhZcwAADsQAAA7EAZUrDhsAAAANSURBVBhXYzh8+PB/AAffA0nNPuCLAAAAAElFTkSuQmCC",26,"5, 18",16,"m,f",Arts,"[['offer', 27.5], ['locate', 20.62], ['small', 10.62], ['write', 9.38], ['writing', 6.25], ['begin', 5.62], ['specialize', 5.62], ['fashion', 5.0], ['kindergarten', 5.0], ['read', 4.38]]",Arts and Design,82.78,67.22
18,Chaparral Ranch,Multiple Locations,Adventure/Outdoors Horseback Riding Animals,https://images.activityhero.com/provider_photo/7017/tile/download_(1).png,"The spirit of the West meets Silicon Valley at Chaparral Ranch. Surrounded by natural trails and open space preserves, the ranch overlooks stunning Bay…read more >",https://www.activityhero.com/biz/chaparral-ranch,"data:image/png;base64,iVBORw0KGgoAAAANSUhEUgAAAAEAAAABCAYAAAAfFcSJAAAAAXNSR0IArs4c6QAAAARnQU1BAACxjwv8YQUAAAAJcEhZcwAADsQAAA7EAZUrDhsAAAANSURBVBhXYzh8+PB/AAffA0nNPuCLAAAAAElFTkSuQmCC",28.2,",19",8,m,Arts,"[['dance', 36.9], ['training', 12.83], ['ballet', 9.63], ['open', 8.56], ['space', 8.02], ['meet', 5.88], ['natural', 5.35], ['toddler', 4.81], ['joy', 4.81], ['west', 3.21]]",Arts and Design,99.84,85.3
19,3 O'Clock Rock,Multiple Locations,History Hip Hop Music,https://images.activityhero.com/provider_photo/108408/tile/6c9e0a8f-5d60-4925-ac1b-a03b2bbab344.jpg,Three O’Clock Rock is an after-school and Summer music program for kids and adults. The program offers a unique approach to teaching music and their own…read more >,https://www.activityhero.com/biz/16700-three-o-clock-rock-oakland-ca,"data:image/png;base64,iVBORw0KGgoAAAANSUhEUgAAAAEAAAABCAYAAAAfFcSJAAAAAXNSR0IArs4c6QAAAARnQU1BAACxjwv8YQUAAAAJcEhZcwAADsQAAA7EAZUrDhsAAAANSURBVBhXYzh8+PB/AAffA0nNPuCLAAAAAElFTkSuQmCC",32.1,"12,20",120,f,Arts,"[['music', 38.76], ['lesson', 17.7], ['rock', 8.13], ['group', 6.7], ['private', 6.7], ['piano', 5.74], ['movement', 5.26], ['voice', 4.78], ['give', 3.35], ['act', 2.87]]",Arts and Design,30.59,38.8
20,Sweet Arts Kid Studio,Multiple Locations,Drawing and Painting Online Course Clay,https://images.activityhero.com/provider_photo/126473/tile/eef9a0ec-fc08-4ed2-a1d0-361250b6ee5b.JPG,Updated for COVID-19​smaller camp size - 10 kids maximumSan Francisco Department of Public Health requires all summer camps to be a minimum of 3-week…read more >,https://www.activityhero.com/biz/sweet-arts-llc,"data:image/png;base64,iVBORw0KGgoAAAANSUhEUgAAAAEAAAABCAYAAAAfFcSJAAAAAXNSR0IArs4c6QAAAARnQU1BAACxjwv8YQUAAAAJcEhZcwAADsQAAA7EAZUrDhsAAAANSURBVBhXYzh8+PB/AAffA0nNPuCLAAAAAElFTkSuQmCC",48.4,"5,19",3999,"m,f",Sports,"[['summer', 43.31], ['camp', 37.58], ['break', 4.78], ['baseball', 4.14], ['spring', 3.18], ['california', 2.23], ['holiday', 1.27], ['enrich', 1.27], ['winter', 1.27], ['custom', 0.96]]",Personal Development,82.08,52.48
21,Golden Gate Skateboarding,Multiple Locations,Skateboarding Yoga,https://images.activityhero.com/provider_photo/135056/tile/e67c5aa8-9378-4263-988e-cfdfdab8af6c.jpg,"Wesley has over 10 years of professional skateboarding instruction experience. Starting out teaching with SF Park& Rec. ""Shred and Butter"" program, and has…read more >",https://www.activityhero.com/biz/golden-gate-skateboarding,"data:image/png;base64,iVBORw0KGgoAAAANSUhEUgAAAAEAAAABCAYAAAAfFcSJAAAAAXNSR0IArs4c6QAAAARnQU1BAACxjwv8YQUAAAAJcEhZcwAADsQAAA7EAZUrDhsAAAANSURBVBhXYzh8+PB/AAffA0nNPuCLAAAAAElFTkSuQmCC",63.3,"5,26",5999,"m,f",STEM,"[['teach', 37.89], ['professional', 13.68], ['teacher', 10.53], ['instruction', 10.0], ['run', 6.84], ['coach', 5.26], ['parent', 4.21], ['background', 4.21], ['basic', 3.68], ['video', 3.68]]",Computer Science,38.65,6.78
22,San Francisco Rock Project,Multiple Locations,Best of ActivityHero 2015 Online Course Music Performing Arts,https://images.activityhero.com/provider_photo/114664/tile/f8abe8cd-fdf3-431e-8832-2ab04f5454fb.jpg,"The San Francisco Rock Project is a nonprofit school of rock for kids ages 7–17. All year round, students have one-on-one lessons on guitar, bass, drums,…read more >",https://www.activityhero.com/biz/13305-san-francisco-rock-project-san-francisco-ca,"data:image/png;base64,iVBORw0KGgoAAAANSUhEUgAAAAEAAAABCAYAAAAfFcSJAAAAAXNSR0IArs4c6QAAAARnQU1BAACxjwv8YQUAAAAJcEhZcwAADsQAAA7EAZUrDhsAAAANSURBVBhXYzh8+PB/AAffA0nNPuCLAAAAAElFTkSuQmCC",67.3,"5,18",141,"m,f",Arts,"[['music', 38.76], ['lesson', 17.7], ['rock', 8.13], ['group', 6.7], ['private', 6.7], ['piano', 5.74], ['movement', 5.26], ['voice', 4.78], ['give', 3.35], ['act', 2.87]]",Arts and Design,57.59,77.83
23,Creative IQ Art Studio,"Creative IQ - San Francisco, CA",Best of ActivityHero 2019 Crafts Drawing and Painting Visual Arts,https://images.activityhero.com/provider_photo/109155/tile/3989815f-852d-4ab8-8f1d-7e55cc36f11f.jpg,"Creative IQ Art Studio offers art classes, camps, parties and workshops for kids, teens and adults!With an emphasis on drawing and painting, our programs…read more >",https://www.activityhero.com/biz/56653-creative-iq-art-studio-san-francisco-ca,"data:image/png;base64,iVBORw0KGgoAAAANSUhEUgAAAAEAAAABCAYAAAAfFcSJAAAAAXNSR0IArs4c6QAAAARnQU1BAACxjwv8YQUAAAAJcEhZcwAADsQAAA7EAZUrDhsAAAANSURBVBhXYzh8+PB/AAffA0nNPuCLAAAAAElFTkSuQmCC",75,"5,18",1,"m,f",Arts,"[['art', 53.8], ['studio', 14.85], ['creative', 9.24], ['artist', 7.92], ['paint', 3.3], ['draw', 2.97], ['learner', 2.64], ['fine', 2.31], ['wellness', 1.65], ['technical', 1.32]]",Arts and Design,47.39,79.84
24,STEMful,"Main Location - San Francisco, CA",Engineering Math Science & Technology,https://images.activityhero.com/provider_photo/100850/tile/d3eee2f3-d7ab-4c6d-8bfd-dde5773c87ed.jpg,"STEMful is dedicated to cultivating a profound interest in science, technology, engineering and math (STEM) in children at a young age. We offer classes and…read more >",https://www.activityhero.com/biz/stemful-58754,"data:image/png;base64,iVBORw0KGgoAAAANSUhEUgAAAAEAAAABCAYAAAAfFcSJAAAAAXNSR0IArs4c6QAAAARnQU1BAACxjwv8YQUAAAAJcEhZcwAADsQAAA7EAZUrDhsAAAANSURBVBhXYzh8+PB/AAffA0nNPuCLAAAAAElFTkSuQmCC",75,"5,18",101,"m,f",STEM,"[['young', 23.33], ['science', 17.14], ['girl', 15.24], ['grade', 11.43], ['provide', 10.0], ['boy', 9.52], ['lab', 3.81], ['woman', 3.81], ['spark', 3.33], ['exceptional', 2.38]]",Computer Science,64.13,67.32
25,Secret Agent Squad by Brain-Bounce,Multiple Locations,Best of ActivityHero 2017 Academics Martial Arts Sports,https://images.activityhero.com/provider_photo/28298/tile/0b900b01-ba8f-4f64-80b4-4d8d9ad59cca.jpg,Science specialists guide the agents as they explore fingerprinting and the fun elements of forensic and GPS tracking technology used to catch real…read more >,https://www.activityhero.com/biz/52796-secret-agent-squad-by-brain-bounce-san-francisco-ca,"data:image/png;base64,iVBORw0KGgoAAAANSUhEUgAAAAEAAAABCAYAAAAfFcSJAAAAAXNSR0IArs4c6QAAAARnQU1BAACxjwv8YQUAAAAJcEhZcwAADsQAAA7EAZUrDhsAAAANSURBVBhXYzh8+PB/AAffA0nNPuCLAAAAAElFTkSuQmCC",93.1,"5,18",46,"m,f",STEM,"[['enrichment', 27.84], ['math', 27.84], ['explore', 17.05], ['discover', 6.82], ['summer', 4.55], ['resource', 3.98], ['present', 3.41], ['visual', 2.84], ['choose', 2.84], ['water', 2.84]]",Computer Science,96,67.88
26,MoonSchool at 42nd Street Moon,Multiple Locations,Music Performing Arts Drama/Theater,https://images.activityhero.com/provider_photo/121830/tile/798aaecf-6d8a-4ef5-ac37-a7a8ea14ddf5.jpg,MoonSchool at 42nd Street Moon offers year-round technique and performance-based classes for youth! Whether your student is brand new to theatre and looking…read more >,https://www.activityhero.com/biz/moonschool-at-42nd-street-moon,"data:image/png;base64,iVBORw0KGgoAAAANSUhEUgAAAAEAAAABCAYAAAAfFcSJAAAAAXNSR0IArs4c6QAAAARnQU1BAACxjwv8YQUAAAAJcEhZcwAADsQAAA7EAZUrDhsAAAANSURBVBhXYzh8+PB/AAffA0nNPuCLAAAAAElFTkSuQmCC",9,"5, 19",111,"m,f",Arts,"[['mission', 39.26], ['theatre', 9.82], ['promote', 9.2], ['performance', 7.36], ['gymnastic', 7.36], ['healthy', 6.75], ['offer', 6.13], ['training', 4.91], ['lead', 4.91], ['chef', 4.29]]",Arts and Design,52.02,70.57
27,Camp Brainy Bunch,Multiple Locations,Leadership Public Speaking Science & Technology,https://images.activityhero.com/provider_photo/102029/tile/63094476-0226-4410-bd59-6f2b1f5e20f8.jpg,Camp Brainy Bunch is part of the larger Education Unlimited Inc. family of academic summer programs devoted to giving you the best options for summer…read more >,https://www.activityhero.com/biz/camp-brainy-bunch,"data:image/png;base64,iVBORw0KGgoAAAANSUhEUgAAAAEAAAABCAYAAAAfFcSJAAAAAXNSR0IArs4c6QAAAARnQU1BAACxjwv8YQUAAAAJcEhZcwAADsQAAA7EAZUrDhsAAAANSURBVBhXYzh8+PB/AAffA0nNPuCLAAAAAElFTkSuQmCC",14.9,"5, 19",321,m,Sports,"[['adult', 27.78], ['family', 26.11], ['martial_art', 15.0], ['large', 6.67], ['self_defense', 5.56], ['part', 5.56], ['passion', 3.33], ['baby', 3.33], ['core', 3.33], ['mountain', 3.33]]",Personal Development,85.73,66.74
28,Planet Bee Foundation,Multiple Locations,Biology Science & Technology Environmental,https://images.activityhero.com/provider_photo/108835/tile/7aecdf40-761d-4603-89ce-136ca904c06c.jpg,"Planet Bee Foundation is dedicated to creating environmental stewards of all ages, who will go on to have a positive impact on our interconnected world.We…read more >",https://www.activityhero.com/biz/planet-bee-foundation,"data:image/png;base64,iVBORw0KGgoAAAANSUhEUgAAAAEAAAABCAYAAAAfFcSJAAAAAXNSR0IArs4c6QAAAARnQU1BAACxjwv8YQUAAAAJcEhZcwAADsQAAA7EAZUrDhsAAAANSURBVBhXYzh8+PB/AAffA0nNPuCLAAAAAElFTkSuQmCC",25.9,",20",541,m,STEM,"[['design', 29.56], ['game', 18.87], ['age', 17.61], ['programming', 8.18], ['computer', 6.92], ['offering', 5.66], ['virtual', 4.4], ['kid', 3.77], ['provide', 2.52], ['support', 2.52]]",Computer Science,62.4,8.83
29,Girls Leading Girls,Multiple Locations,Girls Only Leadership Soccer,https://images.activityhero.com/provider_photo/101537/tile/eb8b77dd-8893-4dee-89e3-58c45b31a003.JPG,Girls Leading Girls is a San Francisco based nonprofit organization that trains young women in leadership and life skills through soccer. Our programs focus…read more >,https://www.activityhero.com/biz/girls-leading-girls,"data:image/png;base64,iVBORw0KGgoAAAANSUhEUgAAAAEAAAABCAYAAAAfFcSJAAAAAXNSR0IArs4c6QAAAARnQU1BAACxjwv8YQUAAAAJcEhZcwAADsQAAA7EAZUrDhsAAAANSURBVBhXYzh8+PB/AAffA0nNPuCLAAAAAElFTkSuQmCC",26.6,"5,20",3000,f,STEM,"[['young', 23.33], ['science', 17.14], ['girl', 15.24], ['grade', 11.43], ['provide', 10.0], ['boy', 9.52], ['lab', 3.81], ['woman', 3.81], ['spark', 3.33], ['exceptional', 2.38]]",Math & Logic,89.09,78.49
30,Chris Babcock Art,Multiple Locations,Drop-off Drawing and Painting Visual Arts,https://images.activityhero.com/provider_photo/111711/tile/bd5939a8-49dc-496a-8daf-269f87dc6b5f.png,"Our Mission at Chris Babcock Art:1) Instruct art campers how to develop creative and technical drawing and painting skills through playful projects and fun,…read more >",https://www.activityhero.com/biz/chris-babcock-art,,7,"5, 19",191,f,Arts,"[['art', 53.8], ['studio', 14.85], ['creative', 9.24], ['artist', 7.92], ['paint', 3.3], ['draw', 2.97], ['learner', 2.64], ['fine', 2.31], ['wellness', 1.65], ['technical', 1.32]]",Arts and Design,32.51,22.01
