id,title,location,sub_category,avatar,description,details,provider,distance,ages,price,campus,camp_type,topics,category,relevance,affordability
736,American English College,Multiple Locations,Language ESL Test Prep,https://images.activityhero.com/provider_photo/145638/tile/d3b3d03a-385d-4371-a37c-f0afd4cf81f7.png,American English College is an ACCET accredited + SEVIS approved language program. We specialize in English language program and test preparation for…read more >,https://www.activityhero.com/biz/american-english-college,"data:image/png;base64,iVBORw0KGgoAAAANSUhEUgAAAAEAAAABCAYAAAAfFcSJAAAAAXNSR0IArs4c6QAAAARnQU1BAACxjwv8YQUAAAAJcEhZcwAADsQAAA7EAZUrDhsAAAANSURBVBhXYzh8+PB/AAffA0nNPuCLAAAAAElFTkSuQmCC",26.6,"5,81",45,m,Arts,"[['language', 17.11], ['school', 13.16], ['development', 12.5], ['preschool', 12.5], ['teach', 8.55], ['immersion', 8.55], ['spanish', 8.55], ['english', 6.58], ['skill', 6.58], ['valley', 5.92]]",Arts and Design,59.68,36.47
737,Erinn Crane Piano,Multiple Locations,Piano Music,https://images.activityhero.com/provider_photo/145579/tile/b5bd4710-790f-47c6-9b69-4d33cc75fd16.jpeg,Experienced Music teacher with ability to teach piano or woodwinds at all levels.  I do individual half hour weekly lessons by appointment.,,,27,"5,73",49,"m,f",Arts,"[['music', 38.76], ['lesson', 17.7], ['rock', 8.13], ['group', 6.7], ['private', 6.7], ['piano', 5.74], ['movement', 5.26], ['voice', 4.78], ['give', 3.35], ['act', 2.87]]",Arts and Design,54.4,52.84
738,Academy of Ballet and Etiquette,Multiple Locations,Preschool Ballet Performing Arts,https://images.activityhero.com/provider_photo/145560/tile/29f53bf5-0655-403f-9f52-86097dccb7ad.png,The Academy of Ballet and Etiquette brings ballet and etiquette classes to venues all around the Bay Area. We help children build physical confidence and…read more >,https://www.activityhero.com/biz/academy-of-ballet-and-etiquette,"data:image/png;base64,iVBORw0KGgoAAAANSUhEUgAAAAEAAAABCAYAAAAfFcSJAAAAAXNSR0IArs4c6QAAAARnQU1BAACxjwv8YQUAAAAJcEhZcwAADsQAAA7EAZUrDhsAAAANSURBVBhXYzh8+PB/AAffA0nNPuCLAAAAAElFTkSuQmCC",29.2,"5,73",41,m,STEM,"[['build', 22.54], ['focus', 16.18], ['confidence', 11.56], ['time', 10.4], ['start', 8.67], ['technique', 8.67], ['encourage', 6.94], ['fundamental', 5.78], ['commit', 5.78], ['house', 3.47]]",Computer Science,54.12,47.01
739,Manhattan Fencing Center,Multiple Locations,Fitness Fencing Sports,https://images.activityhero.com/provider_photo/145556/tile/5a66aa54-42d9-47e7-b263-dacc5f3fddfa.jpg,"Located in Midtown Manhattan, the Manhattan Fencing Center was started in 2007 by U.S. Fencing Hall of Fame Maestro Yury Gelman. We believe that fencing…read more >",https://www.activityhero.com/biz/manhattan-fencing-center,"data:image/png;base64,iVBORw0KGgoAAAANSUhEUgAAAAEAAAABCAYAAAAfFcSJAAAAAXNSR0IArs4c6QAAAARnQU1BAACxjwv8YQUAAAAJcEhZcwAADsQAAA7EAZUrDhsAAAANSURBVBhXYzh8+PB/AAffA0nNPuCLAAAAAElFTkSuQmCC",33.1,"5,73",153,f,Sports,"[['sport', 28.24], ['offer', 24.12], ['variety', 11.76], ['facility', 8.24], ['place', 5.88], ['fence', 4.71], ['staff', 4.71], ['craft', 4.12], ['entertainment', 4.12], ['wide', 4.12]]",Personal Development,96.2,21.37
740,The Etiquette Factory by Miss Kim llc,Multiple Locations,Family Social Skills Mindfulness,https://images.activityhero.com/provider_photo/145567/tile/1ca529a1-1c91-46f2-b1b0-e051b8667426.jpeg,"We offer Etiquette and Manners programs to Business Professionals, Adults, Teens, and Children. Online Programs on Activityhero:- Perfectly Polite Dining…read more >",https://www.activityhero.com/biz/the-etiquette-factory-by-miss-kin,"data:image/png;base64,iVBORw0KGgoAAAANSUhEUgAAAAEAAAABCAYAAAAfFcSJAAAAAXNSR0IArs4c6QAAAARnQU1BAACxjwv8YQUAAAAJcEhZcwAADsQAAA7EAZUrDhsAAAANSURBVBhXYzh8+PB/AAffA0nNPuCLAAAAAElFTkSuQmCC",49.4,"5,73",2032,"m,f",Arts,"[['program', 29.17], ['focus', 14.88], ['creative', 9.52], ['workshop', 9.52], ['home', 7.14], ['nurture', 7.14], ['people', 6.55], ['session', 5.36], ['children', 5.36], ['lego', 5.36]]",Arts and Design,68.6,56.05
741,Smart Mind Robotics,Multiple Locations,Coding Robotics Lego,https://images.activityhero.com/provider_photo/117694/tile/503932d9-1205-47d0-9499-9161ebac59fd.jpeg,Our robots for kids after school program curriculum is tailored to younger students but can be varied very easily. A mixed class with younger and older…read more >,https://www.activityhero.com/biz/smart-mind-robotics,"data:image/png;base64,iVBORw0KGgoAAAANSUhEUgAAAAEAAAABCAYAAAAfFcSJAAAAAXNSR0IArs4c6QAAAARnQU1BAACxjwv8YQUAAAAJcEhZcwAADsQAAA7EAZUrDhsAAAANSURBVBhXYzh8+PB/AAffA0nNPuCLAAAAAElFTkSuQmCC",64.3,"5, 74",58,"m,f",STEM,"[['young', 23.33], ['science', 17.14], ['girl', 15.24], ['grade', 11.43], ['provide', 10.0], ['boy', 9.52], ['lab', 3.81], ['woman', 3.81], ['spark', 3.33], ['exceptional', 2.38]]",Computer Science,85.66,58.53
742,Sylvan Learning of La Mesa,Multiple Locations,Academic Writing Reading Math,https://images.activityhero.com/provider_photo/142033/tile/a2cc8b14-5129-4d97-8cd1-757267b893a1.jpg,"At Sylvan Learning of La Mesa, we're focused on building academic confidence, igniting intellectual curiosity and inspiring a love for learning -- all of…read more >",https://www.activityhero.com/biz/sylvan-learning-of-la-mesa-72436,"data:image/png;base64,iVBORw0KGgoAAAANSUhEUgAAAAEAAAABCAYAAAAfFcSJAAAAAXNSR0IArs4c6QAAAARnQU1BAACxjwv8YQUAAAAJcEhZcwAADsQAAA7EAZUrDhsAAAANSURBVBhXYzh8+PB/AAffA0nNPuCLAAAAAElFTkSuQmCC",68.3,"5, 74",45,"m,f",STEM,"[['build', 22.54], ['focus', 16.18], ['confidence', 11.56], ['time', 10.4], ['start', 8.67], ['technique', 8.67], ['encourage', 6.94], ['fundamental', 5.78], ['commit', 5.78], ['house', 3.47]]",Math & Logic,56.12,50.47
743,Wizzy Esports,Multiple Locations,Programming Gaming Science & Technology,https://images.activityhero.com/provider_photo/145546/tile/9201b639-944f-4e88-a170-c4fc1b1eb369.png,We are proud to be one of the emerging leaders in the youth esports industry. Wizzy is unique in that we are devoted exclusively to providing children and…read more >,https://www.activityhero.com/biz/wizzy-esports,"data:image/png;base64,iVBORw0KGgoAAAANSUhEUgAAAAEAAAABCAYAAAAfFcSJAAAAAXNSR0IArs4c6QAAAARnQU1BAACxjwv8YQUAAAAJcEhZcwAADsQAAA7EAZUrDhsAAAANSURBVBhXYzh8+PB/AAffA0nNPuCLAAAAAElFTkSuQmCC",76,",75",49,"m,f",STEM,"[['year', 36.17], ['teaching', 13.48], ['inspire', 9.93], ['teen', 8.51], ['theater', 7.09], ['kind', 6.38], ['positive', 4.96], ['method', 4.96], ['mindfulness', 4.26], ['broadway', 4.26]]",Math & Logic,91.59,39.5
744,Hi-Five Sports Franchising,Multiple Locations,Science & Technology Music Multisport,https://images.activityhero.com/provider_photo/120846/tile/79a96a7c-3d12-4868-a9ee-d5f251ac8828.jpg,This is the culmination of nearly 30 years of experience in youth sports. The first Hi-Five Sports Zone opened its doors in San Francisco in 2014. Our…read more >,https://www.activityhero.com/biz/hi-five-sports-franchising,"data:image/png;base64,iVBORw0KGgoAAAANSUhEUgAAAAEAAAABCAYAAAAfFcSJAAAAAXNSR0IArs4c6QAAAARnQU1BAACxjwv8YQUAAAAJcEhZcwAADsQAAA7EAZUrDhsAAAANSURBVBhXYzh8+PB/AAffA0nNPuCLAAAAAElFTkSuQmCC",76,"5,75",41,"m,f",Sports,"[['sport', 28.24], ['offer', 24.12], ['variety', 11.76], ['facility', 8.24], ['place', 5.88], ['fence', 4.71], ['staff', 4.71], ['craft', 4.12], ['entertainment', 4.12], ['wide', 4.12]]",Personal Development,81.45,44.17
745,Creative Talent Network,Multiple Locations,Voice Acting Drawing and Painting,https://images.activityhero.com/provider_photo/142198/tile/a5fde769-6deb-49ad-abee-4c6c7e29a9ef.jpg,"CTN is a very rich creative environment.  A place to promote the values, talent and skill of a group of artists we know as visual storytellers.",,"data:image/png;base64,iVBORw0KGgoAAAANSUhEUgAAAAEAAAABCAYAAAAfFcSJAAAAAXNSR0IArs4c6QAAAARnQU1BAACxjwv8YQUAAAAJcEhZcwAADsQAAA7EAZUrDhsAAAANSURBVBhXYzh8+PB/AAffA0nNPuCLAAAAAElFTkSuQmCC",94.1,"5, 74",153,"m,f",Arts,"[['art', 53.8], ['studio', 14.85], ['creative', 9.24], ['artist', 7.92], ['paint', 3.3], ['draw', 2.97], ['learner', 2.64], ['fine', 2.31], ['wellness', 1.65], ['technical', 1.32]]",Arts and Design,70.94,98.61
746,Art Academy,Multiple Locations,Online Course Drawing and Painting Visual Arts,https://images.activityhero.com/provider_photo/145470/tile/a75375a1-78e1-416b-979a-14d76dffeabe.jpg,"The mission of Art Academy is to inspire, educate, and build confidence in children and adults through the core fundamentals and elements of visual art.…read more >",https://www.activityhero.com/biz/art-academy-73801,"data:image/png;base64,iVBORw0KGgoAAAANSUhEUgAAAAEAAAABCAYAAAAfFcSJAAAAAXNSR0IArs4c6QAAAARnQU1BAACxjwv8YQUAAAAJcEhZcwAADsQAAA7EAZUrDhsAAAANSURBVBhXYzh8+PB/AAffA0nNPuCLAAAAAElFTkSuQmCC",10,",75",4032,"m,f",STEM,"[['build', 22.54], ['focus', 16.18], ['confidence', 11.56], ['time', 10.4], ['start', 8.67], ['technique', 8.67], ['encourage', 6.94], ['fundamental', 5.78], ['commit', 5.78], ['house', 3.47]]",Computer Science,65.13,100
747,Insights Intervention,Multiple Locations,For Grown-Ups Online Course,https://images.activityhero.com/provider_photo/145467/tile/d97970e4-5caf-4296-9393-659160e0bb58.jpg,"INSIGHTS Intervention envisions a world where every child is cherished as a unique individual and supported to reach his or her optimal social, emotional,…read more >",https://www.activityhero.com/biz/insights-intervention,"data:image/png;base64,iVBORw0KGgoAAAANSUhEUgAAAAEAAAABCAYAAAAfFcSJAAAAAXNSR0IArs4c6QAAAARnQU1BAACxjwv8YQUAAAAJcEhZcwAADsQAAA7EAZUrDhsAAAANSURBVBhXYzh8+PB/AAffA0nNPuCLAAAAAElFTkSuQmCC",15.9,"12,76",6032,m,STEM,"[['child', 26.13], ['make', 23.62], ['life', 15.08], ['strive', 9.05], ['potential', 6.03], ['tool', 5.53], ['prepare', 5.03], ['unique', 4.02], ['speak', 3.02], ['tutor', 2.51]]",Math & Logic,50.63,37.52
748,"Little Explorers, LLC",Multiple Locations,Online Course Science & Technology Academics,https://images.activityhero.com/provider_photo/113127/tile/13e01990-8306-4539-834b-e838bf7352e4.jpg,"Little Explorers LLC, Enrichment Learning Program provides hands-on learning activities and summer camp for elementary, middle & high school-age students…read more >",https://www.activityhero.com/biz/little-explorers-llc,"data:image/png;base64,iVBORw0KGgoAAAANSUhEUgAAAAEAAAABCAYAAAAfFcSJAAAAAXNSR0IArs4c6QAAAARnQU1BAACxjwv8YQUAAAAJcEhZcwAADsQAAA7EAZUrDhsAAAANSURBVBhXYzh8+PB/AAffA0nNPuCLAAAAAElFTkSuQmCC",26.9,"5,75",174,m,STEM,"[['student', 34.39], ['high', 22.75], ['quality', 19.05], ['elementary', 6.88], ['middle', 6.35], ['rich', 2.65], ['development', 2.65], ['care', 2.12], ['teenager', 1.59], ['expert', 1.59]]",Computer Science,89.31,71.29
749,Code Camp Kidz,Multiple Locations,Coding Computers Science & Technology,https://images.activityhero.com/provider_photo/145241/tile/4caad141-72df-4125-80de-4eb839fbad79.jpg,"Our unique, easy to use, eLearning platform was designed to introduce students to coding in a fun and achievable way. You will have fun building projects…read more >",https://www.activityhero.com/biz/code-camp-kidz,"data:image/png;base64,iVBORw0KGgoAAAANSUhEUgAAAAEAAAABCAYAAAAfFcSJAAAAAXNSR0IArs4c6QAAAARnQU1BAACxjwv8YQUAAAAJcEhZcwAADsQAAA7EAZUrDhsAAAANSURBVBhXYzh8+PB/AAffA0nNPuCLAAAAAElFTkSuQmCC",27.6,"5,82",34,f,STEM,"[['fun', 48.56], ['environment', 12.5], ['engage', 11.54], ['hand', 7.21], ['great', 5.29], ['local', 4.81], ['year', 3.85], ['personal', 2.4], ['perfect', 1.92], ['fill', 1.92]]",Math & Logic,76.61,54.38
750,Parallelogram Institute,Multiple Locations,Coding Engineering Science & Technology,https://images.activityhero.com/provider_photo/145490/tile/4d7ad5ae-43fe-411c-84f5-9e79ed56e7c1.jpg,"Our company was formed to help educators, parents, and students reach the next academic level without losing any time. As a small business own by…read more >",https://www.activityhero.com/biz/parallelogram-institute,"data:image/png;base64,iVBORw0KGgoAAAANSUhEUgAAAAEAAAABCAYAAAAfFcSJAAAAAXNSR0IArs4c6QAAAARnQU1BAACxjwv8YQUAAAAJcEhZcwAADsQAAA7EAZUrDhsAAAANSURBVBhXYzh8+PB/AAffA0nNPuCLAAAAAElFTkSuQmCC",8,"5,74",134,f,STEM,"[['student', 41.94], ['academic', 12.9], ['debate', 7.74], ['support', 7.1], ['speech', 6.45], ['modern', 5.81], ['public', 5.81], ['offer', 4.52], ['week_long', 3.87], ['impact', 3.87]]",Math & Logic,51.95,81.19
751,The Queens Gambit Chess Inc.,Multiple Locations,Gaming Academics Chess,https://images.activityhero.com/provider_photo/145039/tile/3d0bab1a-d09a-4df2-ab6c-e824bef0aad8.jpg,The Center is the main center of Queen's Gambit where the benefits of chess are used to spark innovation and collaboration. We support organizations and…read more >,https://www.activityhero.com/biz/the-queens-gambit-chess-inc,"data:image/png;base64,iVBORw0KGgoAAAANSUhEUgAAAAEAAAABCAYAAAAfFcSJAAAAAXNSR0IArs4c6QAAAARnQU1BAACxjwv8YQUAAAAJcEhZcwAADsQAAA7EAZUrDhsAAAANSURBVBhXYzh8+PB/AAffA0nNPuCLAAAAAElFTkSuQmCC",13.9,"5,74",79,m,STEM,"[['center', 32.79], ['company', 19.13], ['empower', 8.2], ['curriculum', 7.1], ['palo_alto', 6.56], ['real', 6.01], ['bring', 6.01], ['heart', 5.46], ['passionate', 4.37], ['city', 4.37]]",Computer Science,33.45,54.36
752,Long Island & Queens Music for Aarvarks,Multiple Locations,Music,https://images.activityhero.com/provider_photo/145133/tile/c29d875d-d2ef-4159-881c-8d823ca00a4b.jpg,"Music for Aardvarks is not your run of the mill children’s music class, it’s a program for toddlers, kids and their grownups to come “rock out” and have…read more >",https://www.activityhero.com/biz/long-island-queens-music-for-aarvarks,"data:image/png;base64,iVBORw0KGgoAAAANSUhEUgAAAAEAAAABCAYAAAAfFcSJAAAAAXNSR0IArs4c6QAAAARnQU1BAACxjwv8YQUAAAAJcEhZcwAADsQAAA7EAZUrDhsAAAANSURBVBhXYzh8+PB/AAffA0nNPuCLAAAAAElFTkSuQmCC",24.9,"5,74",144,m,Arts,"[['music', 38.76], ['lesson', 17.7], ['rock', 8.13], ['group', 6.7], ['private', 6.7], ['piano', 5.74], ['movement', 5.26], ['voice', 4.78], ['give', 3.35], ['act', 2.87]]",Arts and Design,92.11,18.67
753,Little Medical School - Honolulu,Multiple Locations,Biology Science & Technology Science,https://images.activityhero.com/provider_photo/145113/tile/e12f7efe-97d6-4488-b47d-139b516dbd8d.jpg,"Little Veterinarian School (Age 4-12)Does your child love animals? Little Veterinarian School teaches kids all about ANIMAL Care in a FUN, Engaging and…read more >",https://www.activityhero.com/biz/little-medical-school-73634,"data:image/png;base64,iVBORw0KGgoAAAANSUhEUgAAAAEAAAABCAYAAAAfFcSJAAAAAXNSR0IArs4c6QAAAARnQU1BAACxjwv8YQUAAAAJcEhZcwAADsQAAA7EAZUrDhsAAAANSURBVBhXYzh8+PB/AAffA0nNPuCLAAAAAElFTkSuQmCC",25.6,"5,74",354,m,Sports,"[['love', 22.54], ['adventure', 19.01], ['camper', 11.97], ['outdoor', 10.56], ['dedicate', 8.45], ['american', 7.75], ['area', 7.04], ['mobile', 4.93], ['learn', 4.23], ['animal', 3.52]]",Personal Development,52.52,94.14
754,Vesper School of Music,Multiple Locations,Violin Piano Music,https://images.activityhero.com/provider_photo/145069/tile/645dd2f1-b542-4d9f-9025-a54ec7ae9e5c.JPG,"At Vesper School of Music, we offer students of all ages personalized one-on-one virtual instruction in piano, violin, guitar, voice, ukulele, music…read more >",https://www.activityhero.com/biz/vesper-school-of-music,"data:image/png;base64,iVBORw0KGgoAAAANSUhEUgAAAAEAAAABCAYAAAAfFcSJAAAAAXNSR0IArs4c6QAAAARnQU1BAACxjwv8YQUAAAAJcEhZcwAADsQAAA7EAZUrDhsAAAANSURBVBhXYzh8+PB/AAffA0nNPuCLAAAAAElFTkSuQmCC",26,"5, 75",574,m,Arts,"[['music', 38.76], ['lesson', 17.7], ['rock', 8.13], ['group', 6.7], ['private', 6.7], ['piano', 5.74], ['movement', 5.26], ['voice', 4.78], ['give', 3.35], ['act', 2.87]]",Arts and Design,31.82,87.2
755,Ni Hao Chinese,Multiple Locations,Online Course Language Visual Arts,https://images.activityhero.com/provider_photo/145033/tile/86ddbc7c-bd8d-4854-81a5-cde927e6f659.png,"Ni Hao Chinese has educational opportunities for children of all ages, from Parent and Me classes for toddlers, preschool program for 2-6 yrs old, and…read more >",https://www.activityhero.com/biz/ni-hao-chinese-73576,"data:image/png;base64,iVBORw0KGgoAAAANSUhEUgAAAAEAAAABCAYAAAAfFcSJAAAAAXNSR0IArs4c6QAAAARnQU1BAACxjwv8YQUAAAAJcEhZcwAADsQAAA7EAZUrDhsAAAANSURBVBhXYzh8+PB/AAffA0nNPuCLAAAAAElFTkSuQmCC",28.2,"5, 75",3033,"m,f",Arts,"[['language', 17.11], ['school', 13.16], ['development', 12.5], ['preschool', 12.5], ['teach', 8.55], ['immersion', 8.55], ['spanish', 8.55], ['english', 6.58], ['skill', 6.58], ['valley', 5.92]]",Arts and Design,31.4,27.21
756,Be A Maker Club,"Online - Palo Alto, CA",Engineering Computers Science & Technology,https://images.activityhero.com/provider_photo/105494/tile/4e7e397f-d682-4117-91b0-35b028ba4145.jpg,We are makers that help you makeWe started teaching children computer aided design and manufacturing (CAD & CAM) in our makerspace lab in 2018. Our focus…read more >,https://www.activityhero.com/biz/be-a-maker-club,"data:image/png;base64,iVBORw0KGgoAAAANSUhEUgAAAAEAAAABCAYAAAAfFcSJAAAAAXNSR0IArs4c6QAAAARnQU1BAACxjwv8YQUAAAAJcEhZcwAADsQAAA7EAZUrDhsAAAANSURBVBhXYzh8+PB/AAffA0nNPuCLAAAAAElFTkSuQmCC",32.1,",76",224,m,STEM,"[['build', 22.54], ['focus', 16.18], ['confidence', 11.56], ['time', 10.4], ['start', 8.67], ['technique', 8.67], ['encourage', 6.94], ['fundamental', 5.78], ['commit', 5.78], ['house', 3.47]]",Math & Logic,90.27,17.81
757,"Inspirit AI, Inc.",Multiple Locations,Science & Technology College Preparation/Counseling Programming,https://images.activityhero.com/provider_photo/144834/tile/30c06c8f-a0ed-4b32-87d9-d0ad4810f313.jpeg,Inspirit AI is a pre-college Artificial Intelligence education program developed and taught by a team of graduate students from Stanford University. The…read more >,https://www.activityhero.com/biz/inspirit-ai-inc,"data:image/png;base64,iVBORw0KGgoAAAANSUhEUgAAAAEAAAABCAYAAAAfFcSJAAAAAXNSR0IArs4c6QAAAARnQU1BAACxjwv8YQUAAAAJcEhZcwAADsQAAA7EAZUrDhsAAAANSURBVBhXYzh8+PB/AAffA0nNPuCLAAAAAElFTkSuQmCC",48.4,"5,76",59,f,Sports,"[['club', 24.2], ['soccer', 17.83], ['team', 14.65], ['year_round', 10.19], ['basketball', 7.01], ['ca', 6.37], ['dedicate', 5.73], ['north', 5.1], ['clinic', 5.1], ['swim', 3.82]]",Personal Development,73.96,28.06
758,STEM Kids NYC,Multiple Locations,Coding Engineering Science & Technology,https://images.activityhero.com/provider_photo/144779/tile/1165d54e-50ab-4a2d-b6f8-8c5f1dfc74ff.jpg,We’re an education company that bridges the gap between the current curriculum in schools and the immediate need for schools to prepare students for…read more >,https://www.activityhero.com/biz/stem-kids-nyc,"data:image/png;base64,iVBORw0KGgoAAAANSUhEUgAAAAEAAAABCAYAAAAfFcSJAAAAAXNSR0IArs4c6QAAAARnQU1BAACxjwv8YQUAAAAJcEhZcwAADsQAAA7EAZUrDhsAAAANSURBVBhXYzh8+PB/AAffA0nNPuCLAAAAAElFTkSuQmCC",63.3,"5, 75",46,"m,f",STEM,"[['student', 34.39], ['high', 22.75], ['quality', 19.05], ['elementary', 6.88], ['middle', 6.35], ['rich', 2.65], ['development', 2.65], ['care', 2.12], ['teenager', 1.59], ['expert', 1.59]]",Math & Logic,85.36,33
759,Dr. Barbara Seniors Harkins Foundation,Multiple Locations,Photography and Video Community Service Free Activities,https://images.activityhero.com/provider_photo/103234/tile/52aa891a-63af-4570-8d54-60b09d325928.JPG,We’re a non-profit foundation that strives to motivate children to pursue education beyond high school. We believe the way to achieve this is by combining…read more >,https://www.activityhero.com/biz/dr-barbara-seniors-harkins-foundation,"data:image/png;base64,iVBORw0KGgoAAAANSUhEUgAAAAEAAAABCAYAAAAfFcSJAAAAAXNSR0IArs4c6QAAAARnQU1BAACxjwv8YQUAAAAJcEhZcwAADsQAAA7EAZUrDhsAAAANSURBVBhXYzh8+PB/AAffA0nNPuCLAAAAAElFTkSuQmCC",67.3,",76",50,"m,f",STEM,"[['child', 26.13], ['make', 23.62], ['life', 15.08], ['strive', 9.05], ['potential', 6.03], ['tool', 5.53], ['prepare', 5.03], ['unique', 4.02], ['speak', 3.02], ['tutor', 2.51]]",Computer Science,81.2,18.51
760,Yes Class MATH /Reading & Writing,Multiple Locations,Tutoring Reading Math,https://images.activityhero.com/provider_photo/144839/tile/0887f27b-f893-4071-99fa-b6ca2d46b3ff.jpg,Your Educational Success  K-12Global Education company for After School program.,,"data:image/png;base64,iVBORw0KGgoAAAANSUhEUgAAAAEAAAABCAYAAAAfFcSJAAAAAXNSR0IArs4c6QAAAARnQU1BAACxjwv8YQUAAAAJcEhZcwAADsQAAA7EAZUrDhsAAAANSURBVBhXYzh8+PB/AAffA0nNPuCLAAAAAElFTkSuQmCC",63.3,"12,77",42,"m,f",Sports,"[['skill', 32.8], ['develop', 18.52], ['creativity', 14.81], ['social', 7.94], ['chess', 7.94], ['approach', 4.76], ['thinking', 3.7], ['global', 3.7], ['problem', 3.17], ['passion', 2.65]]",Personal Development,60.39,41.33
761,"N’spire After School Program, LLC",Multiple Locations,Hip Hop Dance After School Care,https://images.activityhero.com/provider_photo/144565/tile/ad04ef79-b493-44f9-b3c2-2d834329b061.png,N’spire After School Program LLC is a mobile dance program dedicated to the advancement for dance and the high quality of performance. N’spire After…read more >,https://www.activityhero.com/biz/n-spire-after-school-program-llc,"data:image/png;base64,iVBORw0KGgoAAAANSUhEUgAAAAEAAAABCAYAAAAfFcSJAAAAAXNSR0IArs4c6QAAAARnQU1BAACxjwv8YQUAAAAJcEhZcwAADsQAAA7EAZUrDhsAAAANSURBVBhXYzh8+PB/AAffA0nNPuCLAAAAAElFTkSuQmCC",75,"5,76",154,"m,f",Arts,"[['dance', 36.9], ['training', 12.83], ['ballet', 9.63], ['open', 8.56], ['space', 8.02], ['meet', 5.88], ['natural', 5.35], ['toddler', 4.81], ['joy', 4.81], ['west', 3.21]]",Arts and Design,48.01,13.62
762,Yoga Ed,Multiple Locations,Free Activities Mindfulness Yoga,https://images.activityhero.com/provider_photo/144538/tile/8e1dab3d-8acf-4933-9a19-3c5002951f4a.jpg,Our children’s yoga and mindfulness programs provide a variety of tools for anyone who works with children. Whether you want to learn how to teach fun and…read more >,https://www.activityhero.com/biz/yoga-ed,"data:image/png;base64,iVBORw0KGgoAAAANSUhEUgAAAAEAAAABCAYAAAAfFcSJAAAAAXNSR0IArs4c6QAAAARnQU1BAACxjwv8YQUAAAAJcEhZcwAADsQAAA7EAZUrDhsAAAANSURBVBhXYzh8+PB/AAffA0nNPuCLAAAAAElFTkSuQmCC",93.1,"5,83",2033,"m,f",STEM,"[['base', 30.29], ['program', 21.14], ['project', 13.71], ['yoga', 9.14], ['lead', 5.71], ['innovative', 4.57], ['nature', 4.57], ['develop', 4.0], ['teach', 4.0], ['workshop', 2.86]]",Math & Logic,81.07,18.88
763,"Super Soccer Stars - Washington, DC",Multiple Locations,Online Course Soccer Sports,https://images.activityhero.com/provider_photo/118020/tile/675cbad7-a300-4f64-86ee-f06ccf1206a0.jpg,"At Super Soccer Stars, it is our goal to teach soccer skills in a fun, non-competitive, educational environment. Our philosophy is to use soccer to nurture,…read more >",https://www.activityhero.com/biz/super-soccer-stars-washington-dc,"data:image/png;base64,iVBORw0KGgoAAAANSUhEUgAAAAEAAAABCAYAAAAfFcSJAAAAAXNSR0IArs4c6QAAAARnQU1BAACxjwv8YQUAAAAJcEhZcwAADsQAAA7EAZUrDhsAAAANSURBVBhXYzh8+PB/AAffA0nNPuCLAAAAAElFTkSuQmCC",9,"5,75",59,"m,f",Sports,"[['club', 24.2], ['soccer', 17.83], ['team', 14.65], ['year_round', 10.19], ['basketball', 7.01], ['ca', 6.37], ['dedicate', 5.73], ['north', 5.1], ['clinic', 5.1], ['swim', 3.82]]",Personal Development,69.11,14.38
764,UCode Inc,Multiple Locations,Coding Online Course Programming,https://images.activityhero.com/provider_photo/144016/tile/d1ad322c-1593-4508-b4c5-76c14d82a611.jpg,UCode builds strong computational thinking abilities with students ages 6 to 16 through teaching coding. In an economy driven by information and…read more >,https://www.activityhero.com/biz/ucode-inc,"data:image/png;base64,iVBORw0KGgoAAAANSUhEUgAAAAEAAAABCAYAAAAfFcSJAAAAAXNSR0IArs4c6QAAAARnQU1BAACxjwv8YQUAAAAJcEhZcwAADsQAAA7EAZUrDhsAAAANSURBVBhXYzh8+PB/AAffA0nNPuCLAAAAAElFTkSuQmCC",14.9,"5,75",46,"m,f",Sports,"[['adult', 27.78], ['family', 26.11], ['martial_art', 15.0], ['large', 6.67], ['self_defense', 5.56], ['part', 5.56], ['passion', 3.33], ['baby', 3.33], ['core', 3.33], ['mountain', 3.33]]",Personal Development,39.6,91.28
765,Chess Guru,Multiple Locations,Online Course Chess After School Care,https://images.activityhero.com/provider_photo/144927/tile/b47c6207-4e8a-45a2-aaca-ae8bdf15454e.jpg,"Simone Sobel wants to share her passion and experience as a chess player with her students.  Through the magical of the game, children will develop…read more >",https://www.activityhero.com/biz/chess-guru,"data:image/png;base64,iVBORw0KGgoAAAANSUhEUgAAAAEAAAABCAYAAAAfFcSJAAAAAXNSR0IArs4c6QAAAARnQU1BAACxjwv8YQUAAAAJcEhZcwAADsQAAA7EAZUrDhsAAAANSURBVBhXYzh8+PB/AAffA0nNPuCLAAAAAElFTkSuQmCC",25.9,"5,75",50,m,Sports,"[['skill', 32.8], ['develop', 18.52], ['creativity', 14.81], ['social', 7.94], ['chess', 7.94], ['approach', 4.76], ['thinking', 3.7], ['global', 3.7], ['problem', 3.17], ['passion', 2.65]]",Personal Development,58.76,59.14
766,Chico's House Youth Development Center,Multiple Locations,Online Course General Recreation Academics,https://images.activityhero.com/provider_photo/112826/tile/52551040-0462-4ebf-9b78-940acdf76a9b.jpeg,"Chico’s House Youth Development Center is a for-profit LLC focused on providing a safe haven for youth 11-17 during Out of School Time (OST) hours, and…read more >",https://www.activityhero.com/biz/chico-s-house-youth-development-center,"data:image/png;base64,iVBORw0KGgoAAAANSUhEUgAAAAEAAAABCAYAAAAfFcSJAAAAAXNSR0IArs4c6QAAAARnQU1BAACxjwv8YQUAAAAJcEhZcwAADsQAAA7EAZUrDhsAAAANSURBVBhXYzh8+PB/AAffA0nNPuCLAAAAAElFTkSuQmCC",26.6,"5,75",42,m,STEM,"[['youth', 35.09], ['day', 24.56], ['safe', 9.36], ['oakland', 7.6], ['junior', 5.26], ['grow', 4.68], ['traditional', 4.09], ['locally', 3.51], ['offer', 2.92], ['mind', 2.92]]",Computer Science,81.94,58.92
