id,title,location,sub_category,avatar,description,details,provider,distance,ages,price,campus,camp_type,topics,category,relevance,affordability
491,Riekes Center for Human Enhancement,Multiple Locations,Nature Programs Adventure/Outdoors Play/Outdoor,https://images.activityhero.com/provider_photo/28081/tile/7ee36645-0122-4923-8a21-d296278e1d94.,The Riekes Center exists for the enhancement of the individual student. Our mission is to provide each student with the best possible opportunity to…read more >,https://www.activityhero.com/biz/52682-riekes-center-for-human-enhancement-menlo-park-ca,"data:image/png;base64,iVBORw0KGgoAAAANSUhEUgAAAAEAAAABCAYAAAAfFcSJAAAAAXNSR0IArs4c6QAAAARnQU1BAACxjwv8YQUAAAAJcEhZcwAADsQAAA7EAZUrDhsAAAANSURBVBhXYzh8+PB/AAffA0nNPuCLAAAAAElFTkSuQmCC",74,"5,54",3021,"m,f",STEM,"[['good', 21.43], ['world', 15.08], ['future', 12.7], ['individual', 10.32], ['active', 9.52], ['knowledge', 7.14], ['feature', 6.35], ['change', 6.35], ['improve', 5.56], ['benefit', 5.56]]",Computer Science,87.64,84.62
492,Martial Arts America - San Ramon,"San Ramon - San Ramon, CA",Martial Arts,https://images.activityhero.com/provider_photo/11317/tile/open-uri20141205-10-w8hx7k,Welcome to Martial Arts America - home of the award winning program Karate 4 Kids. Our proven teaching methods are designed to provide a positive…read more >,https://www.activityhero.com/biz/23351-martial-arts-america-san-ramon-ca,"data:image/png;base64,iVBORw0KGgoAAAANSUhEUgAAAAEAAAABCAYAAAAfFcSJAAAAAXNSR0IArs4c6QAAAARnQU1BAACxjwv8YQUAAAAJcEhZcwAADsQAAA7EAZUrDhsAAAANSURBVBhXYzh8+PB/AAffA0nNPuCLAAAAAElFTkSuQmCC",92.1,"5,54",212,"m,f",STEM,"[['year', 36.17], ['teaching', 13.48], ['inspire', 9.93], ['teen', 8.51], ['theater', 7.09], ['kind', 6.38], ['positive', 4.96], ['method', 4.96], ['mindfulness', 4.26], ['broadway', 4.26]]",Computer Science,56.75,9.52
493,AR Workshop Danville,"Main Location - Danville, CA",Woodworking Crafts Drawing and Painting,https://images.activityhero.com/provider_photo/136376/tile/a9414cc6-0d9d-4ea9-a4ff-8c2dc06fa26d.jpg,"AR Workshop is a boutique DIY creative studio offering hands-on classes to create charming custom wood signs, pillows, home decor and more!Join us at AR…read more >",https://www.activityhero.com/biz/ar-workshop-danville,"data:image/png;base64,iVBORw0KGgoAAAANSUhEUgAAAAEAAAABCAYAAAAfFcSJAAAAAXNSR0IArs4c6QAAAARnQU1BAACxjwv8YQUAAAAJcEhZcwAADsQAAA7EAZUrDhsAAAANSURBVBhXYzh8+PB/AAffA0nNPuCLAAAAAElFTkSuQmCC",8,"5,54",47,"m,f",STEM,"[['create', 30.54], ['online', 19.76], ['world', 13.77], ['live', 9.58], ['weekly', 5.39], ['maker', 4.79], ['leader', 4.79], ['curiosity', 4.19], ['free', 3.59], ['culture', 3.59]]",Math & Logic,48.06,45.44
494,Gaming Together,Multiple Locations,Social Skills Gaming,https://images.activityhero.com/provider_photo/116454/tile/6176210c-8590-4ac8-8003-d84aa1fbcf3a.jpg,"Gaming Together offers after-school gaming groups, summer camps, and school break camps. Dungeons & Dragons is our main activity: kids each play a…read more >",https://www.activityhero.com/biz/gaming-together-65862,"data:image/png;base64,iVBORw0KGgoAAAANSUhEUgAAAAEAAAABCAYAAAAfFcSJAAAAAXNSR0IArs4c6QAAAARnQU1BAACxjwv8YQUAAAAJcEhZcwAADsQAAA7EAZUrDhsAAAANSURBVBhXYzh8+PB/AAffA0nNPuCLAAAAAElFTkSuQmCC",13.9,"5, 55",34,"m,f",Sports,"[['summer', 43.31], ['camp', 37.58], ['break', 4.78], ['baseball', 4.14], ['spring', 3.18], ['california', 2.23], ['holiday', 1.27], ['enrich', 1.27], ['winter', 1.27], ['custom', 0.96]]",Personal Development,85.17,53.17
495,J ACE J Music,"Main Location - Redwood City, CA",Music Music Theory Piano,https://images.activityhero.com/provider_photo/95557/tile/82935210-45bd-4405-b72b-67fe5a61a5bd.jpg,"We are a music community center in Redwood City since 2006.  We specialize in instrument and voice lessons, band classes, rehearsal rooms, and music…read more >",https://www.activityhero.com/biz/67551-j-ace-j-music-redwood-city-ca,"data:image/png;base64,iVBORw0KGgoAAAANSUhEUgAAAAEAAAABCAYAAAAfFcSJAAAAAXNSR0IArs4c6QAAAARnQU1BAACxjwv8YQUAAAAJcEhZcwAADsQAAA7EAZUrDhsAAAANSURBVBhXYzh8+PB/AAffA0nNPuCLAAAAAElFTkSuQmCC",24.9,"5, 55",38,m,Arts,"[['music', 38.76], ['lesson', 17.7], ['rock', 8.13], ['group', 6.7], ['private', 6.7], ['piano', 5.74], ['movement', 5.26], ['voice', 4.78], ['give', 3.35], ['act', 2.87]]",Arts and Design,38.93,56.9
496,Tal's Patisserie,"Main Location - Danville, CA",Cooking,https://images.activityhero.com/provider_photo/108665/tile/b00e44ac-2366-4a97-ad69-de388822bf54.jpg,"Tal's Patisserie is an all natural neighborhood bake shop, specializing in sweet and savory European baked goods. We use organic flours and locally grown…read more >",https://www.activityhero.com/biz/tal-s-patisserie,"data:image/png;base64,iVBORw0KGgoAAAANSUhEUgAAAAEAAAABCAYAAAAfFcSJAAAAAXNSR0IArs4c6QAAAARnQU1BAACxjwv8YQUAAAAJcEhZcwAADsQAAA7EAZUrDhsAAAANSURBVBhXYzh8+PB/AAffA0nNPuCLAAAAAElFTkSuQmCC",25.6,",56",30,m,Arts,"[['offer', 27.5], ['locate', 20.62], ['small', 10.62], ['write', 9.38], ['writing', 6.25], ['begin', 5.62], ['specialize', 5.62], ['fashion', 5.0], ['kindergarten', 5.0], ['read', 4.38]]",Arts and Design,33.12,74.97
497,Bryerly Farms,"Main Location - Walnut Creek, CA",Nature Programs Gardening Horseback Riding,https://images.activityhero.com/provider_photo/114384/tile/8db5375a-fe5a-4208-a088-1b8658c6f5e0.JPG,"Bryerly Farms is a permaculture-inspired farm located in Walnut Creek, one block from beautiful Mt. Diablo State Park. We use organic farming methods,…read more >",https://www.activityhero.com/biz/bryerly-farms,"data:image/png;base64,iVBORw0KGgoAAAANSUhEUgAAAAEAAAABCAYAAAAfFcSJAAAAAXNSR0IArs4c6QAAAARnQU1BAACxjwv8YQUAAAAJcEhZcwAADsQAAA7EAZUrDhsAAAANSURBVBhXYzh8+PB/AAffA0nNPuCLAAAAAElFTkSuQmCC",26,"5,56",142,f,Arts,"[['offer', 27.5], ['locate', 20.62], ['small', 10.62], ['write', 9.38], ['writing', 6.25], ['begin', 5.62], ['specialize', 5.62], ['fashion', 5.0], ['kindergarten', 5.0], ['read', 4.38]]",Arts and Design,87.2,96.91
498,Excel Basketball Camp,"Main Location - Walnut Creek, CA",Basketball Sports,https://images.activityhero.com/provider_photo/107993/tile/f81874a0-cb61-4334-b5d0-8ae39a7cb579.jpeg,"At Excel Basketball Camp you can rest assured knowing that your child is going to enjoy a great camp experience.  Established in 1981, Excel is one of the…read more >",https://www.activityhero.com/biz/excel-basketball-camp-62234,"data:image/png;base64,iVBORw0KGgoAAAANSUhEUgAAAAEAAAABCAYAAAAfFcSJAAAAAXNSR0IArs4c6QAAAARnQU1BAACxjwv8YQUAAAAJcEhZcwAADsQAAA7EAZUrDhsAAAANSURBVBhXYzh8+PB/AAffA0nNPuCLAAAAAElFTkSuQmCC",28.2,"5, 55",2021,f,STEM,"[['youth', 35.09], ['day', 24.56], ['safe', 9.36], ['oakland', 7.6], ['junior', 5.26], ['grow', 4.68], ['traditional', 4.09], ['locally', 3.51], ['offer', 2.92], ['mind', 2.92]]",Computer Science,43.49,51.02
499,CrossFit San Ramon,"Main Location - San Ramon, CA",Fitness,https://images.activityhero.com/provider_photo/110068/tile/4a1264d5-1871-4eb1-bc7e-7e01456ade35.jpg,CrossFit San Ramon- Forging Elite Fitness one workout at a time. Offering great programs for any age and any fitness level including Youth CrossFit  and…read more >,https://www.activityhero.com/biz/crossfit-san-ramon,"data:image/png;base64,iVBORw0KGgoAAAANSUhEUgAAAAEAAAABCAYAAAAfFcSJAAAAAXNSR0IArs4c6QAAAARnQU1BAACxjwv8YQUAAAAJcEhZcwAADsQAAA7EAZUrDhsAAAANSURBVBhXYzh8+PB/AAffA0nNPuCLAAAAAElFTkSuQmCC",32.1,",56",47,m,STEM,"[['age', 46.46], ['offer', 18.69], ['level', 15.66], ['beginner', 4.55], ['inspire', 4.04], ['foundation', 2.53], ['garden', 2.02], ['daily', 2.02], ['elite', 2.02], ['gain', 2.02]]",Math & Logic,40.08,79.88
500,Broadway Babies & Kids,Multiple Locations,Fitness Yoga Dance,https://images.activityhero.com/provider_photo/111898/tile/d355ff0a-dbc0-44fa-82d1-dfb85773e75c.jpg,"At Broadway Babies & Kids, we train and entertain your budding performing! From music, rhythm and song & dance classes for out littlest performers…read more >",https://www.activityhero.com/biz/broadway-kids,"data:image/png;base64,iVBORw0KGgoAAAANSUhEUgAAAAEAAAABCAYAAAAfFcSJAAAAAXNSR0IArs4c6QAAAARnQU1BAACxjwv8YQUAAAAJcEhZcwAADsQAAA7EAZUrDhsAAAANSURBVBhXYzh8+PB/AAffA0nNPuCLAAAAAElFTkSuQmCC",48.4,"12,57",34,m,Arts,"[['music', 38.76], ['lesson', 17.7], ['rock', 8.13], ['group', 6.7], ['private', 6.7], ['piano', 5.74], ['movement', 5.26], ['voice', 4.78], ['give', 3.35], ['act', 2.87]]",Arts and Design,36.93,8.26
501,I Can Do That Theatre Company,"Main Location - Danville, CA",Acting Drama/Theater Dance,https://images.activityhero.com/provider_photo/102896/tile/a372d2ac-5058-4f89-af3b-e90ea0e36583.jpg,"I Can Do That is a non-profit youth theatre company dedicated to creating professional, full-scale musicals by combining quality training with…read more >",https://www.activityhero.com/biz/i-can-do-that-theatre-company,"data:image/png;base64,iVBORw0KGgoAAAANSUhEUgAAAAEAAAABCAYAAAAfFcSJAAAAAXNSR0IArs4c6QAAAARnQU1BAACxjwv8YQUAAAAJcEhZcwAADsQAAA7EAZUrDhsAAAANSURBVBhXYzh8+PB/AAffA0nNPuCLAAAAAElFTkSuQmCC",63.3,"5,56",38,m,STEM,"[['center', 32.79], ['company', 19.13], ['empower', 8.2], ['curriculum', 7.1], ['palo_alto', 6.56], ['real', 6.01], ['bring', 6.01], ['heart', 5.46], ['passionate', 4.37], ['city', 4.37]]",Math & Logic,85.52,17.67
502,Art Studio,"Main Location - Fremont, CA",Crafts Printmaking Visual Arts,https://images.activityhero.com/provider_photo/101934/tile/f4739a70-fda8-4907-b2d0-320b3f9dfa8e.jpg,"ATT art academy teaches about techniques of print-making. Our classes are fun and effective, methods are creative and an outcome is spectacular!",,"data:image/png;base64,iVBORw0KGgoAAAANSUhEUgAAAAEAAAABCAYAAAAfFcSJAAAAAXNSR0IArs4c6QAAAARnQU1BAACxjwv8YQUAAAAJcEhZcwAADsQAAA7EAZUrDhsAAAANSURBVBhXYzh8+PB/AAffA0nNPuCLAAAAAElFTkSuQmCC",67.3,"5,63",30,m,Arts,"[['art', 53.8], ['studio', 14.85], ['creative', 9.24], ['artist', 7.92], ['paint', 3.3], ['draw', 2.97], ['learner', 2.64], ['fine', 2.31], ['wellness', 1.65], ['technical', 1.32]]",Arts and Design,96.26,17.19
503,Axis Learning Company-  Home of Aloha Mind Math,Multiple Locations,Science & Technology Academics Math,https://images.activityhero.com/provider_photo/101851/tile/894c570f-043f-4d07-a982-2d6532ddb0b1.png,"Overview:Did you know math is rooted in our visual neural networks? This STEM program will present math in a hands-on, engaging and fun environment! Your…read more >",https://www.activityhero.com/biz/aloha-mind-math,"data:image/png;base64,iVBORw0KGgoAAAANSUhEUgAAAAEAAAABCAYAAAAfFcSJAAAAAXNSR0IArs4c6QAAAARnQU1BAACxjwv8YQUAAAAJcEhZcwAADsQAAA7EAZUrDhsAAAANSURBVBhXYzh8+PB/AAffA0nNPuCLAAAAAElFTkSuQmCC",75,"5,55",142,"m,f",STEM,"[['enrichment', 27.84], ['math', 27.84], ['explore', 17.05], ['discover', 6.82], ['summer', 4.55], ['resource', 3.98], ['present', 3.41], ['visual', 2.84], ['choose', 2.84], ['water', 2.84]]",Computer Science,42.68,26.8
504,Pro Soccer Camp,Multiple Locations,Fitness Soccer Sports,https://images.activityhero.com/provider_photo/101638/tile/0ba38fee-be24-404e-a221-88457308a7f3.png,"Our Soccer Camps provide a great place for any soccer player who is looking to improve their skills, work hard and have fun! Our mission is to provide…read more >",https://www.activityhero.com/biz/pro-soccer-camp,"data:image/png;base64,iVBORw0KGgoAAAANSUhEUgAAAAEAAAABCAYAAAAfFcSJAAAAAXNSR0IArs4c6QAAAARnQU1BAACxjwv8YQUAAAAJcEhZcwAADsQAAA7EAZUrDhsAAAANSURBVBhXYzh8+PB/AAffA0nNPuCLAAAAAElFTkSuQmCC",75,"5,55",4021,m,Sports,"[['club', 24.2], ['soccer', 17.83], ['team', 14.65], ['year_round', 10.19], ['basketball', 7.01], ['ca', 6.37], ['dedicate', 5.73], ['north', 5.1], ['clinic', 5.1], ['swim', 3.82]]",Personal Development,60.23,52.44
505,Running Camp,Multiple Locations,,https://images.activityhero.com/provider_photo/99641/tile/3a0c8049-7633-495c-aa89-6d8ff142a262.jpg,I am devoted to helping both runners and athletes get better at running technique as well as training them to get in better shape during the off season of…read more >,https://www.activityhero.com/biz/running-camp,"data:image/png;base64,iVBORw0KGgoAAAANSUhEUgAAAAEAAAABCAYAAAAfFcSJAAAAAXNSR0IArs4c6QAAAARnQU1BAACxjwv8YQUAAAAJcEhZcwAADsQAAA7EAZUrDhsAAAANSURBVBhXYzh8+PB/AAffA0nNPuCLAAAAAElFTkSuQmCC",93.1,"5,55",6021,f,STEM,"[['build', 22.54], ['focus', 16.18], ['confidence', 11.56], ['time', 10.4], ['start', 8.67], ['technique', 8.67], ['encourage', 6.94], ['fundamental', 5.78], ['commit', 5.78], ['house', 3.47]]",Math & Logic,43.87,31.62
506,Pinta Libre,"Main Location - Benicia, CA",Crafts Drawing and Painting Visual Arts,https://images.activityhero.com/provider_photo/141523/tile/2242f057-5d16-4fbf-ac53-f9472b1be88d.jpg,"Painting classes available for all levels and ages starting 5 years old. Watercolor, Acrylic, Oils, Mix media, Drawing and more.Watercolor: When choosing…read more >",https://www.activityhero.com/biz/pinta-libre,"data:image/png;base64,iVBORw0KGgoAAAANSUhEUgAAAAEAAAABCAYAAAAfFcSJAAAAAXNSR0IArs4c6QAAAARnQU1BAACxjwv8YQUAAAAJcEhZcwAADsQAAA7EAZUrDhsAAAANSURBVBhXYzh8+PB/AAffA0nNPuCLAAAAAElFTkSuQmCC",9,"5,55",163,"m,f",Arts,"[['art', 53.8], ['studio', 14.85], ['creative', 9.24], ['artist', 7.92], ['paint', 3.3], ['draw', 2.97], ['learner', 2.64], ['fine', 2.31], ['wellness', 1.65], ['technical', 1.32]]",Arts and Design,52.04,71.7
507,Sewing Lessons in Redwood City,"Main Location - Redwood City, CA",Sewing Fashion Design Crafts,https://images.activityhero.com/provider_photo/136400/tile/2904a8f0-ee5b-4234-b748-357c6fd8688e.jpeg,"Group classes can be very discouraging. You may feel left behind. You may become frustrated because your instructor goes over things you already know, in…read more >",https://www.activityhero.com/biz/sewing-lessons-in-redwood-city,"data:image/png;base64,iVBORw0KGgoAAAANSUhEUgAAAAEAAAABCAYAAAAfFcSJAAAAAXNSR0IArs4c6QAAAARnQU1BAACxjwv8YQUAAAAJcEhZcwAADsQAAA7EAZUrDhsAAAANSURBVBhXYzh8+PB/AAffA0nNPuCLAAAAAElFTkSuQmCC",14.9,"5, 56",23,"m,f",STEM,"[['educational', 21.05], ['provide', 15.79], ['engineering', 11.84], ['science_technology', 9.87], ['international', 8.55], ['challenge', 8.55], ['steam', 7.89], ['service', 5.92], ['tutoring', 5.26], ['people', 5.26]]",Math & Logic,51.6,36.04
508,Wherry Academy,"Main Location - Redwood City, CA",Creative Writing Tutoring Math,https://images.activityhero.com/provider_photo/118077/tile/0056ccf3-12b5-4b83-bf27-91f91cd6f90d.jpg,"Wherry Academy is located in Redwood City, California and is offering summer camps for kids age 5-18 years old.  Wherry Academy prepares each student with…read more >",https://www.activityhero.com/biz/wherry-academy,"data:image/png;base64,iVBORw0KGgoAAAANSUhEUgAAAAEAAAABCAYAAAAfFcSJAAAAAXNSR0IArs4c6QAAAARnQU1BAACxjwv8YQUAAAAJcEhZcwAADsQAAA7EAZUrDhsAAAANSURBVBhXYzh8+PB/AAffA0nNPuCLAAAAAElFTkSuQmCC",25.9,"5, 56",123,"m,f",Sports,"[['summer', 43.31], ['camp', 37.58], ['break', 4.78], ['baseball', 4.14], ['spring', 3.18], ['california', 2.23], ['holiday', 1.27], ['enrich', 1.27], ['winter', 1.27], ['custom', 0.96]]",Personal Development,56.13,69.72
509,Functional Soccer Academy,Multiple Locations,Soccer,https://images.activityhero.com/provider_photo/110681/tile/3ee4453a-a12c-409a-a437-f4d26c758283.jpg,"Functional Soccer Academy in Concord, California offers summer camps to he youth during the spring break. We provide training for beginners and skill…read more >",https://www.activityhero.com/biz/functional-soccer-academy,"data:image/png;base64,iVBORw0KGgoAAAANSUhEUgAAAAEAAAABCAYAAAAfFcSJAAAAAXNSR0IArs4c6QAAAARnQU1BAACxjwv8YQUAAAAJcEhZcwAADsQAAA7EAZUrDhsAAAANSURBVBhXYzh8+PB/AAffA0nNPuCLAAAAAElFTkSuQmCC",26.6,",57",68,"m,f",Sports,"[['summer', 43.31], ['camp', 37.58], ['break', 4.78], ['baseball', 4.14], ['spring', 3.18], ['california', 2.23], ['holiday', 1.27], ['enrich', 1.27], ['winter', 1.27], ['custom', 0.96]]",Personal Development,88.43,88.48
510,Messy Nessie's Studio,"Main Location - Crockett, CA",Homeschool Drawing and Painting Visual Arts,https://images.activityhero.com/provider_photo/115291/tile/e8573531-e7e7-41c9-b6cb-deafd05e2fc7.jpg,Messy Nessie's is an arts and crafts studio with programming for all ages.  Our studio offers mini-summer camps for ages 4-12!  During our Summer…read more >,https://www.activityhero.com/biz/messy-nessie-s-studio,"data:image/png;base64,iVBORw0KGgoAAAANSUhEUgAAAAEAAAABCAYAAAAfFcSJAAAAAXNSR0IArs4c6QAAAARnQU1BAACxjwv8YQUAAAAJcEhZcwAADsQAAA7EAZUrDhsAAAANSURBVBhXYzh8+PB/AAffA0nNPuCLAAAAAElFTkSuQmCC",7,"5,57",133,"m,f",STEM,"[['design', 29.56], ['game', 18.87], ['age', 17.61], ['programming', 8.18], ['computer', 6.92], ['offering', 5.66], ['virtual', 4.4], ['kid', 3.77], ['provide', 2.52], ['support', 2.52]]",Computer Science,86.43,20.33
511,Warriors Jr. Jam Squad,"Ultimate Fieldhouse - Walnut Creek, CA",Basketball Dance,https://images.activityhero.com/provider_photo/99898/tile/a196c1ec-68a0-48f4-8abb-9cb2e741956e.jpg,The Warriors Jr. Jam Squad is made up of dancers ages 6-14. They perform in front of Warriors fans during home games.,,,12.9,"5, 56",343,"m,f",STEM,"[['child', 26.13], ['make', 23.62], ['life', 15.08], ['strive', 9.05], ['potential', 6.03], ['tool', 5.53], ['prepare', 5.03], ['unique', 4.02], ['speak', 3.02], ['tutor', 2.51]]",Math & Logic,77.66,52.93
512,Broadway By The Bay's Theatre Arts Academy,"Fox Theatre - Redwood City, CA",Acting Drama/Theater Performing Arts,https://images.activityhero.com/provider_photo/111800/tile/22b34cfa-594c-4c3e-8c3d-cf92c18203aa.png,"Broadway By the Bay is excited to present the Theatre Arts Academy, an innovative summer program taking musical theatre training to a whole new…read more >",https://www.activityhero.com/biz/theatre-arts-academy-59061,"data:image/png;base64,iVBORw0KGgoAAAANSUhEUgAAAAEAAAABCAYAAAAfFcSJAAAAAXNSR0IArs4c6QAAAARnQU1BAACxjwv8YQUAAAAJcEhZcwAADsQAAA7EAZUrDhsAAAANSURBVBhXYzh8+PB/AAffA0nNPuCLAAAAAElFTkSuQmCC",23.9,",57",563,"m,f",Arts,"[['mission', 39.26], ['theatre', 9.82], ['promote', 9.2], ['performance', 7.36], ['gymnastic', 7.36], ['healthy', 6.75], ['offer', 6.13], ['training', 4.91], ['lead', 4.91], ['chef', 4.29]]",Arts and Design,58.19,10.03
513,Studio View ~ Cintra Harbach,"Main Location - Crockett, CA",Drawing and Painting Visual Arts Sewing,https://images.activityhero.com/provider_photo/99580/tile/5cfeff1c-ad36-4067-b558-47acada923e8.jpg,"Studio View is in Crockett, CA, North of Berkeley. Cintra Harbach, the Instructor teaches Art & Writing for children, teens, & adults year round.Our…read more >",https://www.activityhero.com/biz/studio-view,"data:image/png;base64,iVBORw0KGgoAAAANSUhEUgAAAAEAAAABCAYAAAAfFcSJAAAAAXNSR0IArs4c6QAAAARnQU1BAACxjwv8YQUAAAAJcEhZcwAADsQAAA7EAZUrDhsAAAANSURBVBhXYzh8+PB/AAffA0nNPuCLAAAAAElFTkSuQmCC",24.6,"12,58",3022,m,Sports,"[['club', 24.2], ['soccer', 17.83], ['team', 14.65], ['year_round', 10.19], ['basketball', 7.01], ['ca', 6.37], ['dedicate', 5.73], ['north', 5.1], ['clinic', 5.1], ['swim', 3.82]]",Personal Development,59.61,3.74
514,Esface Hoop Camp,Multiple Locations,Basketball Sports Girls Only,https://images.activityhero.com/provider_photo/40851/tile/29ebf481-6ffa-4244-8fb6-b99a8bcaab70.jpg,"Team Esface Summer Hoop Camps take you to the next level with a summer experience for boys and girls of all ages and skill level through:
- fun and…read more >",https://www.activityhero.com/biz/53577-esface-hoop-camp-redwood-city-ca,"data:image/png;base64,iVBORw0KGgoAAAANSUhEUgAAAAEAAAABCAYAAAAfFcSJAAAAAXNSR0IArs4c6QAAAARnQU1BAACxjwv8YQUAAAAJcEhZcwAADsQAAA7EAZUrDhsAAAANSURBVBhXYzh8+PB/AAffA0nNPuCLAAAAAElFTkSuQmCC",25,"5,57",213,m,Sports,"[['summer', 43.31], ['camp', 37.58], ['break', 4.78], ['baseball', 4.14], ['spring', 3.18], ['california', 2.23], ['holiday', 1.27], ['enrich', 1.27], ['winter', 1.27], ['custom', 0.96]]",Personal Development,44.57,32.58
515,TechShop - MidPeninsula,"Main Location - Redwood City, CA",,https://images.activityhero.com/provider_photo/98163/tile/c05f602d-7c10-4b7b-a3f5-632c21a9dfe8.jpg,"Conveniently located in Redwood City, TechShop Mid-Peninsula is just off US 101 and almost exactly halfway between our San Jose and San Francisco…read more >",https://www.activityhero.com/biz/techshop-midpenisula,"data:image/png;base64,iVBORw0KGgoAAAANSUhEUgAAAAEAAAABCAYAAAAfFcSJAAAAAXNSR0IArs4c6QAAAARnQU1BAACxjwv8YQUAAAAJcEhZcwAADsQAAA7EAZUrDhsAAAANSURBVBhXYzh8+PB/AAffA0nNPuCLAAAAAElFTkSuQmCC",27.2,"5,64",48,f,STEM,"[['learn', 54.17], ['code', 22.69], ['interactive', 7.87], ['goal', 3.24], ['peninsula', 2.31], ['concept', 2.31], ['engage', 1.85], ['curious', 1.85], ['balance', 1.85], ['snapology', 1.85]]",Math & Logic,95.38,54.83
516,Synergy Badminton Academy,"Main - Menlo Park, CA",Sports Badminton,https://images.activityhero.com/provider_photo/95983/tile/c38714fc-e89d-4f0f-8df0-81c8a8f646fb.jpeg,"Here at Synergy Badminton Academy, we pride ourselves on our expert instructors, quality equipment, and high-end facilities. Together, we create a…read more >",https://www.activityhero.com/biz/synergy-badminton-academy,"data:image/png;base64,iVBORw0KGgoAAAANSUhEUgAAAAEAAAABCAYAAAAfFcSJAAAAAXNSR0IArs4c6QAAAARnQU1BAACxjwv8YQUAAAAJcEhZcwAADsQAAA7EAZUrDhsAAAANSURBVBhXYzh8+PB/AAffA0nNPuCLAAAAAElFTkSuQmCC",31.1,"5,56",35,f,STEM,"[['student', 34.39], ['high', 22.75], ['quality', 19.05], ['elementary', 6.88], ['middle', 6.35], ['rich', 2.65], ['development', 2.65], ['care', 2.12], ['teenager', 1.59], ['expert', 1.59]]",Math & Logic,37.28,30.39
517,Ohlone for Kids and Teens,Multiple Locations,Programming Science American Sign Language,https://images.activityhero.com/provider_photo/95618/tile/428a8042-351d-4fff-9858-5e4968b4d0f7.jpg,"Ohlone for Kids and Teens offers classes that are designed to provide enrichment for children during the summer through an interactive, facilitative…read more >",https://www.activityhero.com/biz/ohlone-for-kids-and-teens,"data:image/png;base64,iVBORw0KGgoAAAANSUhEUgAAAAEAAAABCAYAAAAfFcSJAAAAAXNSR0IArs4c6QAAAARnQU1BAACxjwv8YQUAAAAJcEhZcwAADsQAAA7EAZUrDhsAAAANSURBVBhXYzh8+PB/AAffA0nNPuCLAAAAAElFTkSuQmCC",47.4,"5,56",39,m,Sports,"[['summer', 43.31], ['camp', 37.58], ['break', 4.78], ['baseball', 4.14], ['spring', 3.18], ['california', 2.23], ['holiday', 1.27], ['enrich', 1.27], ['winter', 1.27], ['custom', 0.96]]",Personal Development,95.48,11.1
518,Barbara Davies Art Studio,"Danville - Danville, CA",Crafts Drawing and Painting Visual Arts,https://images.activityhero.com/provider_photo/81139/tile/03102b31-01ca-4e81-9f63-8fddacd3cdf5.,"Barbara Davies teaches art classes in Danville, CA in her studio ""Art On The Lane"" for students of all ages.Barbara holds three CA teaching credentials: K -…read more >",https://www.activityhero.com/biz/57268-barbara-davies-art-studio-danville-ca,"data:image/png;base64,iVBORw0KGgoAAAANSUhEUgAAAAEAAAABCAYAAAAfFcSJAAAAAXNSR0IArs4c6QAAAARnQU1BAACxjwv8YQUAAAAJcEhZcwAADsQAAA7EAZUrDhsAAAANSURBVBhXYzh8+PB/AAffA0nNPuCLAAAAAElFTkSuQmCC",62.3,"5,56",31,m,Arts,"[['art', 53.8], ['studio', 14.85], ['creative', 9.24], ['artist', 7.92], ['paint', 3.3], ['draw', 2.97], ['learner', 2.64], ['fine', 2.31], ['wellness', 1.65], ['technical', 1.32]]",Arts and Design,56.5,86.23
519,Project Ember,Multiple Locations,Best of ActivityHero 2018 Grant winner 2018 Overnight/Residential Engineering Building,https://images.activityhero.com/provider_photo/109764/tile/57fcf349-2fe5-40d5-bc0e-1fe200338c80.jpeg,Project Ember is a maker camp where kids come together to tackle outrageous challenges and create their own larger-than-life solutions.  ​Every week: We…read more >,https://www.activityhero.com/biz/project-ember,"data:image/png;base64,iVBORw0KGgoAAAANSUhEUgAAAAEAAAABCAYAAAAfFcSJAAAAAXNSR0IArs4c6QAAAARnQU1BAACxjwv8YQUAAAAJcEhZcwAADsQAAA7EAZUrDhsAAAANSURBVBhXYzh8+PB/AAffA0nNPuCLAAAAAElFTkSuQmCC",66.3,"5,56",143,m,STEM,"[['create', 30.54], ['online', 19.76], ['world', 13.77], ['live', 9.58], ['weekly', 5.39], ['maker', 4.79], ['leader', 4.79], ['curiosity', 4.19], ['free', 3.59], ['culture', 3.59]]",Math & Logic,38.98,0.56
520,Tale Tree,Multiple Locations,Creative Writing Crafts Drawing and Painting,https://images.activityhero.com/provider_photo/145743/tile/56c3fb6d-c8b9-4640-8fa9-05b6175ab159.png,"Our mission at Tale Tree is to change the way kids experience and expand their creativity. In this ever-changing world, Tale Tree provides a nurturing space…read more >",https://www.activityhero.com/biz/tale-tree,"data:image/png;base64,iVBORw0KGgoAAAANSUhEUgAAAAEAAAABCAYAAAAfFcSJAAAAAXNSR0IArs4c6QAAAARnQU1BAACxjwv8YQUAAAAJcEhZcwAADsQAAA7EAZUrDhsAAAANSURBVBhXYzh8+PB/AAffA0nNPuCLAAAAAElFTkSuQmCC",62.3,"5, 57",2022,m,STEM,"[['experience', 28.51], ['learning', 14.91], ['stem', 12.28], ['hand', 9.65], ['unique', 8.33], ['combine', 7.89], ['age', 6.58], ['develop', 4.39], ['imagination', 3.95], ['dynamic', 3.51]]",Math & Logic,48.08,14.47
521,Globetrotters Summer Camp,"Main Location - Fremont, CA",Do-Together Crafts Visual Arts,https://images.activityhero.com/provider_photo/112801/tile/ce2c4cfe-935b-4db4-910c-65d8579e680b.jpg,"A fascinating camp, that will take you on a journey around the world. Our thought behind this theme is to help children understand, and appreciate the…read more >",https://www.activityhero.com/biz/globetrotters-summer-camp,"data:image/png;base64,iVBORw0KGgoAAAANSUhEUgAAAAEAAAABCAYAAAAfFcSJAAAAAXNSR0IArs4c6QAAAARnQU1BAACxjwv8YQUAAAAJcEhZcwAADsQAAA7EAZUrDhsAAAANSURBVBhXYzh8+PB/AAffA0nNPuCLAAAAAElFTkSuQmCC",74,"5, 57",48,"m,f",Sports,"[['activity', 20.12], ['include', 15.98], ['fitness', 15.98], ['performing_arts', 9.47], ['week', 8.88], ['field', 8.88], ['park', 8.88], ['exciting', 4.73], ['cultural', 4.14], ['theme', 2.96]]",Personal Development,66.1,34.36
